Index,left,Localizers,"zai 'at, in'",right,verb,Verb class,Newness_Theme,Newness_Location,definiteiniteness_Theme,Heaviness,Heaviness_differences,Animacy_Theme,Animacy_Location,Animacy_Location_minorClass,Animacy_Theme_minorClass,Construction_trichotomy,Construction,备注: 住(驻扎，驻)有关的词都从posture变成existence
756,"<s> txt 文章 标题 : 作者 : 】 34 18 : 广场 周围 建筑物 的 回廊 上 悬挂 着 110 盏 中国 的 大红 灯笼 , 二 层 楼 [ [ [",上,点缀,"着 ] ] ] 200 把 中国 的 传统 画 扇 , 东方 艺术 与 西方 建筑 的 巧妙 结合 , 将 广场 装 ... 【 文件名 : \ 当代 \ 报刊 \ 人民 日报 \ 1994年 人民 日报 \ 第1 季度 . </s>",点缀,verbs of existence,new,given,indefinite,Location<Theme,-5,inanimate,inanimate,place,concrete,Locative inversion,Locative inversion,
449,<s> txt 文章 标题 : 作者 : 】 46641 : 起早下草甸子放猪，地主又不给吃晌，劈过一二穗苞米烧吃是真的，那会子岁数小，也不知道不好。”北炕 的 花白 胡子 嘴 [ [ [,上,叼,"着 ] ] ] 烟袋 说 : "" 那 不 算 毛病 , 地主 成年 溜辈 剥削 穷 棒子 , 劈 他 一 穗 两 穗 苞米 ... 【 文件名 : \ 现代 \ 文学 \ 周立波 暴风骤雨 . </s>",叼,verbs of hanging,new,new,indefinite,Location>Theme,7,inanimate,animate,body-part,concrete,Locative inversion,Locative inversion,
786,"<s> txt 文章 标题 : 作者 : 】 37465 : ... 壁炉 的 安乐椅 里 , 他 则 紧挨 着 她 坐在 地板 上 , 身子 倚 着 她 的 双膝 , 嘴 [ [ [",里,叼,着 ] ] ] 支烟 。 </s>,叼,verbs of hanging,new,given,indefinite,Location=Theme,,inanimate,animate,body-part,concrete,Locative inversion,Locative inversion,
86,", � U辏 貉� 亡祸 ? </s><s> 王占 曰 : 往 乃 兹有祟 。 </s><s> 六日 戊子 , 子弓攴囚 。 </s><s> 一月 。 </s><s> 巳卯媚子寅人宜羌十 。 </s><s> ( ... 【 文件名 : \ 当代 \ CWAC \ ALB0035 . </s><s> txt 文章 标题 : 作者 : 】 2395 : 今译 : 癸酉 日 占卜 , 贞人 骰问 : "" 十 日 内 没有 灾祸 吗 ? "" </s><s> 王上 说 有 灾害 。 </s><s> "" 商王 察看 卜兆 后 判断 说 是 这样 , 有 灾祸 , 有 过度 疲劳 之 病 。 "" </s><s> 第五 日 丁丑日 , 商王 亲自 去 祭祀 先王 中丁 , 他 跌倒 [",,在,"] _ 山 上 , 时间 是 十月 。 </s><s> 癸巳日 占卜 , 贞 人 �N 剩骸 笆� 天 内 没有 灾祸 吗 ? </s><s> "" 商王 察看 过 卜兆 判断 说 : "" 就 这些 日子 也 有 灾祸 , 像 说 的 那样 。 </s><s> "" 甲午日 , 商王 去 追赶 独角 犀牛 , 小 臣古 的 车马 碰撞 了 商王 的 车子 , 王子央 也 坠落 下车 来 。 </s><s> 癸 ... 【 文件名 : \ 当代 \ CWAC \ ALB0035 . </s><s> txt 文章 标题 : 作者 : 】 2396 : ... 个 城市 受灾 。 </s><s> 舌方 也 侵犯 我 国",跌倒,verbs of motion,given,new,definite,Location>Theme,2,animate,inanimate,place,human,uninversted sentence (PostLocPs),uninverted sentence,
250,"他 潜意识 里 的 意念 是 : 总 有 个别 地方 会 不 执行 。 当 他 说 前面 的话 时 , 脑中 浮现 出 另 一 意念 , 使 思维 发生 瞬间 的 断裂 , 潜[ 在 ] 的 意念 跟 原来 的话 叠加 [",,在," ] 一起 , 就 生成 了 病 句 ( 3 ) : 【 文件名 : \ 当代 \ CWAC \ ALJ0043.txt 文章 标题 : 作者 : 】 26 27 : 说话 人本 想 说 "" 美国 国务院 抵赖 美国 政府 知情 "" , 他 潜[ 在 ] 的 意念 是 :",叠加,verbs of (dis)appearance,given,new,indefinite,Location<Theme,-7,inanimate,inanimate,place,nonconcrete,uninversted sentence (PostLocPs),uninverted sentence,
871,"<s> 我们 从 电影 或者 电视 里 看到 过 这样 的 镜头 : 身为 母亲 的 女人 , 头 [ [ [",上,顶,"着 ] ] ] 沉重 的 货物 风风火火 地 赶路 , 背 后 背 着 熟睡 的 孩子 , 手 里 还 在 剥 着 回家 ... 【 文件名 : \ 当代 \ 报刊 \ 人民 日报 \ 2000年 人民 日报 \ 2000年 人民 日报 . </s>",顶,verbs of holding or containing,new,given,indefinite,Location<Theme,-3,inanimate,animate,body-part,concrete,Locative inversion,Locative inversion,
285,"中 了 。 </s><s> [ 在 ] 两 种 文化 大规模 遭遇 与 交锋 之 时 , 西方 已经 把 想象 的 误读性 描述 转化 成 了 实质 的 构造性 描述 。 </s><s> 【 文件名 : \ 当代 \ CWAC \ AHJ0026 . </s><s> txt 文章 标题 : 作者 : 】 1684 : 从 把 科学 和 民主 供奉 上 新 的 神龛 到 现代性 追求 的 中断 和 失败 , 中国 对 自己 的 想象 和 言说 一直 [ 在 ] 西方 的 价值 坐标 上下游 走 , 不论是 崇拜 迎合 还是 抗拒 抛弃 , 中国 的 自我 意识 已经 钉 [",,在,"] 了 西方 的 轮盘 上 , 世界 只有 一 个 声音 是 最 响亮 的 一 个 关于 西方 的 价值 神话 和 信念 牢笼 。 </s><s> 这 个 价值 神话 和 信念 牢笼 [ 在 ] 中国 关于 自身 民族 的 想象性 叙事 中 扮演 了 一 个 谆谆 教诲 的 导师 形象 , 亡国 灭种 的 危机 刺激 着 国人 的 每 一 根 神经 。 </s><s> 他们 倾慕 地 看 着 神坛 上 高谈阔论 的 导师 , 不 无 愕然 地 经历 着 被 体罚 与 训导 的 交替 情景 , 产生 着 爱 恨 交织 的 双重",钉,verbs of attachment,new,new,definite,Location=Theme,,inanimate,inanimate,concrete,nonconcrete,uninversted sentence (PostLocPs),uninverted sentence,
328,"作家 文摘 \ 1994 \ 1994A.TXT 文章 标题 : 李德 和 他 的 中国 妻子 作者 : 】 9882 : 花白 的 头发 、 脸 [ [ [ 上 泛 着 ] ] ] 红晕 、 腰板 笔直 、 蓝 毛料 衣 上 钉 着 布扣 ; 说起 话 来 清晰 浑圆 , 那 神情活 ... 【 文件名 : \ 当代 \ 报刊 \ 作家 文摘 \ 1994 \ 1994A.TXT 文章 标题 : 张国焘 和 他 的 两 个 弟弟 作者 : 】 9883 : 花白 的 头发 、 脸上 泛 着 红晕 、 腰板 笔直 、 蓝 毛料 衣[[[",上,钉,"着 ] ] ] 布扣 ; 说起 话 来 清晰 浑圆 , 那 神情 活像 一 个 海外 华人 ; 但 他 却 是 一 个 忠 ... 【 文件名 : \ 当代 \ 报刊 \ 作家 文摘 \ 1994 \ 1994A.TXT 文章 标题 : 张国焘 和 他 的 两 个 弟弟 作者 : 】 9883 : 毛 主席 手[[[ 中 拿 着 ] ] ] 烟 , 看 着 我们 俩 。 </s>",钉,verbs of attachment,new,new,indefinite,Location>Theme,3,inanimate,inanimate,concrete,concrete,Locative inversion,Locative inversion,
403,"<s> 四 人 走近 马匹 , 见 柳树 [[[",上,钉,着 ] ] ] 一 张 纸 。 </s>,钉,verbs of attachment,new,new,indefinite,Location=Theme,,inanimate,inanimate,concrete,concrete,Locative inversion,Locative inversion,
475,<s> txt 文章 标题 : 作者 : 】 24144 : 他 的 金丝 眼镜 [[[,上,抖动,"着 ] ] ] 一点 光 , 他 嘴里 抖动 着 一点光 , 不 知道 是 唾沫 还是 金牙 。 </s>",抖动,verbs of motion,new,given,indefinite,Location>Theme,4,inanimate,inanimate,concrete,nonconcrete,Locative inversion,Locative inversion,
161,"经 子史 等 篇 , 无 不 尽 畅 其 意义 。 "" ( 转 引自 张清常 , 1990 ) 这 是 记载 他 如何 学习 汉语 口语 和 书面语 的 。 另 一 位 著名 的 汉学家 高本汉 学习 汉语 的 经历 亦 复 如是 : ' 高 氏 [",,在," ] 中国 逗留 两 年 , 先 以 数 月 工夫 学会 汉语 口语 。 不久 又 掌握 了 书 面语 , 以后 亲自 走访 各 地 , 口 问 手写 , 调查 了 二十四 个 地点 的 汉语 方言 , 记录 了 十万多 个 字音 , 获得 了 大量 第一手",逗留,verbs of existence,given,new,definite,Location=Theme,1,animate,inanimate,place,human,uninversted sentence (PreLocPs),uninverted sentence,
109,"] , 而 那 年 又 恰巧 是 以 麦克唐纳 为 领袖 的 英国 工党 第一 次 组阁 , 不啻 为 他 的 这 部 学术 著作 提供 了 ... 【 文件名 : \ 当代 \ CWAC \ AHB 0018 . </s><s> txt 文章 标题 : 作者 : 】 12 22:11 年 的 美国 生活 , 无论 [ 在 ] 思想 上 、 生活 方式 上 都 使 他 美国化 了 。 </s><s> 他 受到 当时 正 [ 在 ] 美国 流行 的 自由主义 思潮 的 影响 , 向往 美国 式 的 自由 民主 ; 他 从 小学 到 大学 都 [",,在,"] 教会 学校 读书 , 把 宗教 信仰 视为 健全 精神 生活 的 慰藉 ; 他 崇尚 美国 的 生活 方式 , 像 大多数 美国人 一样 几乎 不 看 纯 文学 作品 ; 他 能 讲 一 口 流利 而 略 带 乡音 的 英语 , 但 讲起 国语 来 却 满口 是 浓重 的 湖南 官话 , 以致 后来 他 做 常驻 联合国 代表 时 因 发言 常 用 英语 而 遭到 时人 的 批评 [ 41 ] 。 </s><s> 尽管 如此 他 并 没有 忘记 祖国 。 </s><s> 1921年 他 [ 在 ] 哥 大 研究院 时 , 适逢 九",读(书),verbs of activity,new,new,indefinite,Location>Theme,4,animate,inanimate,place,human,uninversted sentence (PreLocPs),uninverted sentence,
110,"的 活动 中 , 他 结识 了 同是 后援 会 成员 的 唐玉瑞 小姐 , 两 人 相恋 , 到 1923年 蒋廷黻 博士 毕业 、 归国 前夕 结婚 [ 44 ] 。 </s><s> 【 文件名 : \ 当代 \ CWAC \ AHB 0018 . </s><s> txt 文章 标题 : 作者 : 】 12 23:1923年 , 蒋廷黻 携眷 回国 后 , 应 北方 著名 高等 学府 南开 大学 之 聘 , 出任 历史 教授 。 </s><s> 他 [ 在 ] 南开 任教 六 年 , 心思 和 精力 全 用 [ 在 ] 学问 上 。 </s><s> 首先 , 他 深知 自己 从 小 [",,在,"] 教会 学校 读书 , 国学 基础 很 差 , 必须 先 充实 自己 。 </s><s> 为此 , 他 从重 读 《 四 书 五 经 》 开始 , 进而 研读 《 资治通鉴 》 和 诗词 、 文章 [ 45 ] 。 </s><s> 【 文件名 : \ 当代 \ CWAC \ AHB 0018 . </s><s> txt 文章 标题 : 作者 : 】 1224 : 其次 , 他 [ 在 ] 教学 之余 , 开始 研究 中国 近代 外交史 。 </s><s> 他 对 外交史 的 兴趣 , [ 在 ] 哥 大 做 研究 时 就 已 养成 。 </s><s> 到 南开 后 , 他 开设",读（书）,verbs of activity,new,new,indefinite,Location>Theme,3,animate,inanimate,place,human,uninversted sentence (PreLocPs),uninverted sentence,
11,"CWAC \ AHB 0018 . txt 文章 标题 : 作者 : 】 12 10:1914 一 1918年 , 蒋廷黻 [",,在," ] 俄亥俄州 的 欧 伯 林学院 ( OberlinCollege , Oberlin , Ohio ) 度过 了 他 的 大学 时代 。 蒋廷黻 [ 在 ] 大学 里 主修 历史学 , 同时 也 选读 多 门 自然 科学 课程 [ 17 ] 。 当时 , 他 已 对 祖国 国内 的 军阀 纷争 和 混战 所 引起 的 各 种 问题 产生 了 探究欲 , 希望 通过 历史课 的 学习 , 获得 "" 将来 [ 在",度过,verbs of activity,given,new,definite,Location>Theme,8,animate,inanimate,place,human,uninversted sentence (PreLocPs),uninverted sentence,
491,"<s> 透过 破旧 的 窗纸 , 我 看到 有 个 大 土炕 , 屋 [ [ [",里,堆,"了 ] ] ] 不少 东西 , 显然 很久 没有 人 住 了 。 </s>",堆,verbs of placement,new,new,indefinite,Location<Theme,-2,inanimate,inanimate,place,concrete,Locative inversion,Locative inversion,
712,"<s> 在东面的走廊边，意大将看见许多侍女正在开着的门口低声谈话。便对她们道：“你们应该知道我是最可亲近之人。我虽为男子，却比女人值得信赖，也能教与你们须知之事。我的心情，你们定会慢慢知晓的，所以我很高兴。”众侍女皆缄默不语。就中有一侍女名叫并姐，年事较长，颇话世故，答道：“对于并不亲密之人，总是不便亲近的。不过并非都是如此，比如我，便不是那可以随意见你的亲近之人。但我们这些身为侍女的，若装着怕羞躲避你，未免太可笑了吧！”黛大将道：“你如此断言，在我面前不怕羞，我倒觉得真是遗憾了。"" 他 向 里面 望望 , 但 见 一 [ [ [",旁,堆,"着 ] ] ] 脱下 的 唐装 , 想必 正 纵情 弄笔 。 </s>",堆,verbs of placement,new,given,indefinite,Location<Theme,-3,inanimate,inanimate,place,concrete,Locative inversion,Locative inversion,
697,<s> 这多少可以看出《边城》、《湘行散记》的作者在抗战胜利回到北平后的生活情趣痕迹。但两年以后又在北京相见时，情况却有了很大的变化。记得那是一个风沙满天的严冬，已经快吃午饭了，我在午门右侧旧“朝房”(？)改成的办公室里看见了他。房子很大、很冷，里面放了许多张办公桌，他就坐在其中一只的后面。桌子 [ [ [,上,堆放,"着 ] ] ] 很多 书 、 纸片 、 碎瓷 块 、 破泥人 ...... , 正 象 一 个 荒货摊 。 </s>",堆放,verbs of placement,new,given,indefinite,Location<Theme,-8,inanimate,inanimate,concrete,concrete,Locative inversion,Locative inversion,
427,<s> 清理你桌面上所有的文件资料，只留下与你正要处理的问题有关的东西。假如 你 的 工作台 [ [ [,上,堆满,"了 ] ] ] 各 种 资料 和 物品 , 就 会 让 人 产生 混乱 、 紧张 和 忧虑 的 情绪 , 严重 影响 工 ... 【 文件名 : \ 当代 \ 应用文 \ 健康 养生 \ 沈倩 生活 健康 密码 . </s>",堆满,verbs of placement,new,given,definite,Location=Theme,-1,inanimate,inanimate,concrete,concrete,Locative inversion,Locative inversion,
713,"<s> txt 文章 标题 : 作者 : 】 19771 : 我们 顺着 陈玲 会 指 的 方向 , 挤到 粮仓 旁 进 了 一 号 仓房 , 两 间 仓[[[",内,堆满,了 ] ] ] 洁白 如玉 的 糯米 。 </s>,堆满,verbs of placement,new,given,indefinite,Location<Theme,-3,inanimate,inanimate,place,concrete,Locative inversion,Locative inversion,
684,<s> 第二天，一早晨起来，人们就骂着。汉口的确离着不远了，那大钟楼已经看得清清晰晰的了，江面上的舢板船还有大帆船，是那么多。江 [ [ [,上,发,"着 ] ] ] 各 种 声音 , 说话声 , 打 水声 , 还 有些 噢呵 –– 纤绳 的 声音 。 </s>",发,verbs of emission,new,given,definite,Location<Theme,-2,inanimate,inanimate,concrete,nonconcrete,Locative inversion,Locative inversion,
661,"<s> txt 文章 标题 : 作者 : 】 25557 : 全 国 200 多 所 高校 的 近 4000 名 大学生 投稿 , 报 [ [ [",上,发表,了 ]] ] 22 所 高校 的 32 篇 来稿 。 </s>,发表,verbs of image,new,given,indefinite,Location<Theme,-7,inanimate,inanimate,concrete,concrete,Locative inversion,Locative inversion,
671,<s> txt 文章 标题 : 作者 : 】 8196 : 在日前召开的’９４北京工业投资项目发布会暨恳谈会上，北京市政府向来自世界各地的大型跨国公司代表，世界知名金融机构代表介绍了北京利用外资工作和北京工业的情况及北京吸收外商投资的重点。会 [ [ [,上,发布,了 ]]] 一 批 合资 项目 。 </s>,发布,verbs of image,new,given,indefinite,Location<Theme,-4,inanimate,inanimate,nonconcrete,nonconcrete,Locative inversion,Locative inversion,
124,"在 ] 山东 临沂 银雀山 汉墓 出土 大批 兵书 , 其中 尤 以 《 孙子 兵法 》 与 《 孙膑 兵法 》 更为 珍贵 , 它 澄清 了 从 隋唐 以来 关于 这 二 部 兵书 的 许多 疑点 和 混乱 。 1975年 底 至 1976年 初 , 考古 工作者 [",,在," ] 湖北 云梦 睡 虎 地 发掘 了 12 座 战国 末年 至 秦代 的 墓葬 , 其中 出土 了 1155 支 秦 简 ( 另 有 80 片 残片 ) 。 这 批 秦 简以秦 隶书 书写 , 包括 《 编年 记 》 、 《 语书 》 、 《 秦律",发掘,verbs of activity,new,new,definite,Location<Theme,-4,inanimate,inanimate,place,concrete,uninversted sentence (PreLocPs),uninverted sentence,
59,"声 ( 下文 用 星号 表示 ) , 看 听者 有 什么 反应 。 </s><s> 例如 [ 在 ] 两 个 结构 不同 , 但 后半部 词语 相同 的 句子 各 插入 "" 卡塔 "" 声 : 【 文件名 : \ 当代 \ CWAC \ ALE0037. txt 文章 标题 : 作者 : 】 24 52 : [ 在 ] 放 录音 时 , 两 个 句子 "" 卡塔 "" 声 都 插 [ 在 ] the 与 company 之间 。 </s><s> 可是 听者 的 辨知 结果 很 叫人 诧异 , 他们 认为 , 卡塔声 [ 在 ] 第1 句 里 发生 [",,在,"] influence 与 the 之间 , [ 在 ] 第2 句 里 则 发生 [ 在 ] company 与 was 之间 。 </s><s> 以 此 , [ 在 ] 听话 时 , 人们 是 把 句子 分成 若干 表示 命题 的 短语 或 子句 来 理解 , 并 不 受 插入 的 灶音 的 影响 。 </s><s> 人们 靠 什么 来 建立 命题 , 学者们 有 不同 看法 。 </s><s> 一些 人 以为 主要 靠 句法 知识 , 一些 人 以为 语义 起 决定 作用 。 </s><s> 其实 两 者 都 是 不 可 缺少 。 </s><s> 【 文件名 : \ 当代 \ CWAC \",发生,verbs of (dis)appearance,given,new,definite,Location>Theme,3,inanimate,inanimate,concrete,nonconcrete,uninversted sentence (PostLocPs),uninverted sentence,
71,"可是 听者 的 辨知 结果 很 叫人 诧异 , 他们 认为 , 卡塔声 [",,在,"] 第1 句 里 发生在 influence 与 the 之间 , [ 在 ] 第2 句 里 则 发生 [ 在 ] company 与 was 之间 。",发生,verbs of (dis)appearance,given,new,definite,Location>Theme,2,inanimate,inanimate,place,nonconcrete,uninversted sentence (PreLocPs),uninverted sentence,
120,"所谓概念叠加和构式整合，是在两个意义基本相同的概念之间发生的，意义相同的两个概念叠加后，通过删减其中的某些成分住要是相同成分）的方法，整合为一个新的结构式。概念叠加与构式整合是发生在不同层面、前后相续的两个过程:概念叠加是意义层面的一种概念操作，发生在前;构式整合是语法层面的一种并合，出现在后。叠加现象的产生是基于词或概念的同一性， 这 种 创新 现象 , 既 发生 [",,在," ] 构词 层面 , 也 发生 [ 在 ] 句法 层面 。 【 文件名 : \ 当代 \ CWAC \ ALJ0043.txt 文章 标题 : 作者 : 】 26 07 : ...X "" 三字格 如 "" 动不动 、 时不时 、 偏 不 偏 "" 等 2 。 "" 果然 "" 可 兼用 于 表示 主观 预测 和 客观 规律 的",发生,verbs of (dis)appearance,given,new,definite,Location=Theme,,inanimate,inanimate,nonconcrete,nonconcrete,uninversted sentence (PostLocPs),uninverted sentence,
270,<s> 对这种差异或许起着主要作用的知识，远不是任何哪个人的知识，更不是某个发号施令的超级头脑的知识，而是从一个过程中产生的，在这个过程中，散布在千百万相互交往的个人中的。各 不 相同 甚至 彼此 冲突 的 信念 之 [ [ [,间,发生,着 ] ] ] 实验性 相互 作用 。 </s>,发生,verbs of (dis)appearance,new,new,indefinite,Location>Theme,8,inanimate,inanimate,nonconcrete,nonconcrete,Locative inversion,Locative inversion,
393,有一位兼司法官的县长曾和我谈到过很多这种例子。有个人因妻子偷了汉子打伤了奸夫。在乡间这是理直气壮的，但是和奸没有罪，何况又没有证据，殴伤却有罪。那位县长问我：他怎么判好呢？他更明白，如果是善良的乡下人，自己知道做了坏事决不会到衙门里来的，这些凭借一点法律知识的败类，却会在乡间为非作恶起来，法律还要去保护他。我也承认这是很可能发生的事实。 现行 的 司法 制度 [,,在," ] 乡间 发生 了 很 特殊 的 副作用 , 它 破坏 了 原有 的 礼治 秩序 , 但 并 不 能 有效 的 建立 起 法治 秩序 。 法治 秩序 的 建立 不 能 单靠 制定 若干 法律 条文 和 设立 若干 法庭 , 重要 的 还 得 看 人民 怎样",发生,verbs of (dis)appearance,given,given,indefinite,Location<Theme,-4,inanimate,inanimate,place,nonconcrete,uninversted sentence (PreLocPs),uninverted sentence,
536,"<s> 荣副主席对卡加梅副总统首次访华表示欢迎。他说，中卢建交２０多年来，两国在政治、经济等众多领域进行了富有成果的合作。荣 副主席 说 , 去年 , 卢旺达 国 [ [ [",内,发生,"了 ] ] ] 一些 变化 , 但 中 卢 传统 友谊 和 友好 合作 关系 并 未 受到 影响 。 </s>",发生,verbs of (dis)appearance,new,given,indefinite,Location=Theme,1,inanimate,inanimate,place,nonconcrete,Locative inversion,Locative inversion,
679,"<s> 这 对 中国 的 运动员 来说 是 件 新鲜 事 , 但 我 明白 不 管 我 身[[[",上,发生,"了 ] ] ] 什么 事 , 都 会 为 我 后面 的 球员 开启 或 关闭 大门 。 </s>",发生,verbs of (dis)appearance,new,given,indefinite,Location=Theme,,inanimate,animate,body-part,nonconcrete,Locative inversion,Locative inversion,
140,"为 "" 保育员 "" 、 "" 老师 "" , [ 在 ] 别人 家里 从事 家务 劳动 的 , 除了 称呼 "" 保姆 "" 、 "" 阿姨 "" 之外 , 如今 更 尊称 为 "" 家政 服务员 "" 。 </s><s> 但 不管 怎样 称呼 , 从事 这 类 职业 的 大都 是 妇女 这 一 点 似乎 是 一 个 不 变 的 模因 。 </s><s> 当 我们 [ 在 ] 语用 中 提及 保姆 、 阿姨 、 幼儿园 老师 、 家政 服务员 的 时候 , 我们 大脑 中 的 储存 的 信息 自然 是 女士 。 </s><s> 可是 曾几何时 , 我们 [",,在,"] 报章 中 惊奇 地 发现 很多 新 用法 : 【 文件名 : \ 当代 \ CWAC \ ALJ0042.txt 文章 标题 : 作者 : 】 25 65 : ( 4 ) 胡 老师 是 江西 师范 大学 数学 系 的 本科 毕业生 , [ 在 ] 当地 中学 教 了 几 年 电脑 后 南来 发展 , 1995年 成为 "" 男 阿姨 "" , ( 同上 , 2 版 ) 【 文件名 : \ 当代 \ CWAC \ ALJ0042.txt 文章 标题 : 作者 : 】 2566 : 上面 各 例 中 的 "" 男 阿姨 "" 、 "" 男 保姆",发现,verbs of activity,new,new,indefinite,Location=Theme,-1,inanimate,inanimate,concrete,nonconcrete,uninversted sentence (PreLocPs),uninverted sentence,
217,", 那么 , 按照 伽达默尔 的 概括 , 上述 两 种 总体性 的 区别 就 [ 在 ] 于 : 对于 黑格尔 来说 , 问题 [ 在 ] 于 "" 个人 如何 同 世界 精神 发生 关系 "" ; 对于 马克思 来说 , 问题 [ 在 ] 于 "" 个人 [",,在," ] 何处 发现 自己 处于 作为 人类 社会 基本 结构 的 生产 关系 之中 "" 。 2 【 文件名 : \ 当代 \ CWAC \ APJ0057 . txt 文章 标题 : 作者 : 】 47 27 : 所谓 总体 , 就 其 最 古老 也 是 最 一般 的 含义 而言",发现,verbs of activity,new,new,indefinite,Location<Theme,-18,animate,inanimate,place,human,uninversted sentence (PreLocPs),uninverted sentence,
122,"甲午战争未起以前及既起以后，李鸿章用各种外交方法，想得西洋各国的援助，但都失败了。国际的关系，不比私人间的关系，是不讲理，不论情的。 : 国家 都 是 自私自利 的 。 </s><s> 利害 相同 就 结合 为友 , 为 联盟 ; 利害 冲突 就 成为 对敌 。 </s><s> 各 国 的 外交家 都 是 精于 打算盘 的 。 </s><s> 西洋 各 国 原 想 [",,在,"] 远东 大大 的 发展 , 但 [ 在 ] 甲午 以前 , 没有 积极 推动 , 一 则 因为 他们 忙于 瓜分 非洲 ; 二 则 因为 他们 互相 牵制 各 不 相下 ; 三 则 因为 [ 在 ] 远东 尚 有 中国 与 日本 两 个 独立 国家 , 具有 相当 的 抵抗 能力 。 </s><s> [ 在 ] 中 日 战争 进行 的 时候 , 李鸿章 虽 千方百计 的 请求 他们 的 援助 , 他们 总是 抱 隔岸观火 的 态度 , 严守 中立 。 </s><s> 他们 觉得 中国 愈 败 , 愈 需要 他们 的 援助 , 而且",发展,verbs of (dis)appearance,given,new,definite,Location=Theme,-1,animate,inanimate,place,orginazation,uninversted sentence (PreLocPs),uninverted sentence,
179,"第四，16至18世纪，是世界近代史到来的必不可少的准备阶段。所以，从19世纪初到19世纪末，这是世界从前资本主义时代到资本主义时代的完整过渡期，是世界近代史的真正上限。在这一时期，一方面欧美资产阶级革命仍在继续，其资本主义社会也在向上发展之中，另一方面，占世界人口和面积大多数的亚、非、拉各大洲，都已进入了资本主义社会革命的历史时代，因而，整个世界也就进入了资本主义时代，即进入了近代史的历史阶段。持这种观点的学者提出了世界近代史相对上限的概念。所谓相对上限，就是那些能够在某种程度上将新旧两个时代区分开，但又不能完全区分开的上限。他们认为，在19世纪的范围内，世界近代的相对上限有三个。1.19世纪初，是世界近代史阶段初步到来的历史时刻。因为，第一，英国的机制工业品开始倾销到拉美各国以及亚洲和北非的一些国家，使上述广大地区进入了自己的近代史阶段；第二，1825年英国解除了禁止机器出口的禁令，标志着近代大工业生产力已开始逐渐具备了直接向世界各地传播的能力。这时，近代史的世界性，已经初步形成。2.19世纪中叶，这是世界近代史阶段基本到来的历史时刻。 因为 , 第一 , 工业 革命 [",,在,"] 欧 美 主要 国家 完成 或 迅速 发展 , 使得 西方 大 工业 生产力 向 全球 传播 , 世界 市场 已经 基本上 形成 。 </s><s> 第二 , 西方 的 机制 工业品 , 已经 倾销 到 世界 大部分 落后 国家 和 地区 , 亚 、 非 、 拉 的 许多 国家 开始 产生 或 初步 地 发展 了 自己 的 近代 资本主 ... 【 文件名 : \ 当代 \ CWAC \ AHE0020. txt 文章 标题 : 作者 : 】 1550 : 如今 史学界 大部分 学者 都 持 这 种 观点 , 他们 认为 , 世界 近代史 就 是 一 部 资本主义",发展,verbs of (dis)appearance,new,new,definite,Location>Theme,3,inanimate,inanimate,place,nonconcrete,uninversted sentence (PreLocPs),uninverted sentence,
