Index,left,Localizers,"zai 'at, in'",right,verb,Verb class,Newness_Theme,Newness_Location,definiteiniteness_Theme,Heaviness,Heaviness_differences,Animacy_Theme,Animacy_Location,Animacy_Location_minorClass,Animacy_Theme_minorClass,Construction_trichotomy,Construction,备注: 住(驻扎，驻)有关的词都从posture变成existence
411,靠种地谋生的人才明白泥土的可贵。城里人可以用土气来藐视乡下人，但是乡下，“土”是他们的命根。在数量上占着最高地位的神，无疑的是“土地”。“土地”这位最近于人性的神，老夫老妻白首偕老的一对，管着乡间一切的闲事。他们象征着可贵的泥土。我初次出国时，我的奶妈偷偷的把一包用红纸裹着的东西，塞在我箱子底下。后来，她又避了人和我说，假如水土不服，老是想家时，可以把红纸包裹着的东西煮一点汤吃。这是一包灶上的泥土。 –– 我 [,,在," ] 《 一 曲 难忘 》 的 电影 里 看到 了 东欧 农业 国家 的 波兰 也 有 这 类似 的 风俗 , 使 我 更 领略 了 "" 土 "" [ 在 ] 我们 这 种 文化 里 所 占 和 所 应当 占 的 地位 了 。 【 文件名",看到,change of state,new,new,indefinite,Location<Theme,-6,inanimate,inanimate,concrete,concrete,uninversted sentence (PreLocPs),uninverted sentence,
401,"<s> txt 文章 标题 : 作者 : 】 36487 : 我向哪一个女子说，请你拿下水瓶来，给我水喝，她若说，请喝，我也给你的骆驼喝，愿那女子就作你所预定给你仆人以撒的妻。这样，我便知道你施恩给我主人了。话 还 没有 说完 , 不料 , 利百加 肩头 [ [ [",上,扛,着 ] ] ] 水瓶 出来 。 </s>,扛,verbs of holding or containing,new,given,indefinite,Location>Theme,2,inanimate,animate,body-part,concrete,Locative inversion,Locative inversion,
794,"<s> txt 文章 标题 : 作者 : 】 206 93 : 一 个 身材 很 魁梧 的 人 , 头 上 戴 着 个 斗笠 , 肩 [ [ [",上,扛,"着 ] ] ] 根 竹竿 , 竹竿 上 还 挑 着 一 串 乱七八糟 的 东西 , 她 也 看 不 清 是 什么 , 但 她 ... 【 文件名 : \ 当代 \ 文学 \ 台湾 作家 \ 古龙 陆 小凤 传奇 . </s>",扛,verbs of holding or containing,new,given,indefinite,Location=Theme,-1,inanimate,animate,body-part,concrete,Locative inversion,Locative inversion,
802,<s> txt 文章 标题 : 作者 : 】 275 20 : 他穿上条裤叉子，把褂子在背上一搭，跑下楼梯，到钟楼上探身一看：墙外五步一岗，十步一哨，有穿黑衣裳的警察，穿黄衣裳的保安队。肩 [ [ [,上,扛,"着 ] ] ] 枪 , 枪头 上 按 着 刺刀 。 </s>",扛,verbs of holding or containing,new,given,indefinite,Location=Theme,1,inanimate,animate,body-part,concrete,Locative inversion,Locative inversion,
208,"才 能 成为 像 生物学 、 物理学 、 化学 那样 的 自然 科学 。 刺激 一 反应 ( S–R ) 就 是 华生 行为主义 的 公式 。 他 坚决 主张 把 人 的 心理 彻底 生物学化 和 动物学化 , 说 : "" 人 的 行为 和 动物 的 行为 必须 [",,在," ] 同 一 层面 来 考虑 。 "" 他 特别 重视 行为 的 分子 概念 , 即将 行为 看 做 许多 生理 细节 的 组合 。 华生 坚决 认为 , 传统 心理学 中 的 意识 、 感觉 、 知觉 、 意志 、 表象 等 是 一 大 堆 无用 的 概念",考虑,verbs of activity(passive),new,new,indefinite,Location<Theme,-5,inanimate,inanimate,nonconcrete,nonconcrete,uninversted sentence (PreLocPs),uninverted sentence,
506,"血缘 的 投影 , 不 分离 的 。 "" 生于斯 , 死于斯 "" 把 人 和 地 的 因缘 固定 了 。 生 , 也 就 是 血 , 决定 了 他 的 地 。 世代 间 人口 的 繁殖 , 象 一 个 根 上 长出 的 树苗 ,在地域上靠近",,在," ] 一 伙 。 地域 上 的 靠近 可以 说 是 血缘 上 亲疏 的 一 种 反映 , 区位 是 社会化 了 的 空间 。 我们 [ 在 ] 方向 上 分出 尊卑 : 左尊于 右 , 南尊于 北 , 这 是 血缘 的",靠近,verbs of holding or containing,new,new,indefinite,Location<Theme,-6,inanimate,inanimate,place,concrete,uninversted sentence (PostLocPs),uninverted sentence,
507,"血缘 的 投影 , 不 分离 的 。 "" 生于斯 , 死于斯 "" 把 人 和 地 的 因缘 固定 了 。 生 , 也 就 是 血 , 决定 了 他 的 地 。 世代 间 人口 的 繁殖 , 象 一 个 根 上 长出 的 树苗 , [",,在," ] 地域 上 靠近 [ 在 ] 一 伙 。 地域 上 的 靠近 可以 说 是 血缘 上 亲疏 的 一 种 反映 , 区位 是 社会化 了 的 空间 。 我们 [ 在 ] 方向 上 分出 尊卑 : 左尊于 右 , 南尊于 北 , 这 是 血缘 的",靠近,verbs of holding or containing,new,new,indefinite,Location<Theme,-5,inanimate,inanimate,place,concrete,uninversted sentence (PreLocPs),uninverted sentence,
218,"作者 : 】 23 61 : 六 国 金文 , 是 指 战国 时 东方 六 大 国 及 其 相邻 小 国 铜器 上 的 文字 。 不过 , 礼器 铭文 明显 少于 春秋 时代 , 而 兵器 铭文 却 明显 增多 。 它们 多 直接 用 刀 刻 [",,在," ] 青铜器 上 , 而 不 是 像 西周 、 春秋 金文 铸于 青铜器 上 。 六 国 金文 铭辞 多 较 简短 , 但 有 两 宗 礼器 铭文 不仅 字数 多 , 而且 字形 和 内容 都 非 【 文件名 : \ 当代 \ CWAC \ ALB0035 . txt",刻,verbs of image,new,new,definite,Location>Theme,5,inanimate,inanimate,concrete,concrete,uninversted sentence (PostLocPs),uninverted sentence,
243,<s> 不过只是夏天，这里才有一个很富有并有地位的人家到这儿居住。这是这家人拥有的所有庄园中最漂亮的一座；从外面看，它就像是新盖起来的，里面的设备很舒适方便。门上 的 石头 [ [ [,上,刻,"着 ] ] ] 家族 的 族徽 , 族徽 和 窗子 的 四周 用 美丽 的 玫瑰 盘缠 着 。 </s>",刻,verbs of image,new,new,definite,Location=Theme,1,inanimate,inanimate,concrete,concrete,Locative inversion,Locative inversion,
468,"<s> txt 文章 标题 : 作者 : 】 198 14 : ... , 戴安娜 打开 了 一 个 寄给 查尔斯 的 邮包 , 从 里面 掉出 一 只 手镯 , 内壁 [[[",上,刻,着 ] ] ] 字母 F 和 G 。 </s>,刻,verbs of image,new,given,definite,Location<Theme,-2,inanimate,inanimate,concrete,concrete,Locative inversion,Locative inversion,
546,"<s> 用 天然 磁铁 矿石 琢成 一 个 勺形 的 东西 , 放在 一 个 光滑 的 盘 上 , 盘 [ [ [",上,刻,"着 ] ] ] 方位 , 利用 磁铁 指南 的 作用 , 可以 辨别 方向 。 </s>",刻,verbs of image,new,given,indefinite,Location=Theme,,inanimate,inanimate,concrete,nonconcrete,Locative inversion,Locative inversion,
664,"<s> 左手 的 四 指 上 戴 着 金 戒指 , [ [ [",上,刻,着 ] ] ] 篆字 姓名 。 </s>,刻,verbs of image,new,given,indefinite,Location<Theme,-3,inanimate,inanimate,concrete,concrete,Locative inversion,Locative inversion,
665,"<s> txt 文章 标题 : 作者 : 】 6156 : ... 茔和 矮小 的 墓碑 连成 一 片 , 一望无际 , 人们 只 有 蹲 下来 才 能 看清 墓碑 [ [ [",上,刻,着 ] ] ] 的 死亡者 的 名字 。 </s>,刻,verbs of image,new,given,indefinite,Location<Theme,-3,inanimate,inanimate,concrete,concrete,Locative inversion,Locative inversion,
123,"所谓 女性主义 , 就 是 基于 天赋人权 而 产生 的 、 以 男女 平等 为 核心 的 思想 和 理论 , 旨 [ 在 ] 反对 包括 性别 歧视 [ 在 ] 内 的 一切 不 平等 。 </s><s> 它 指导 了 实践 ( 女权 运动 ) , 又 [ 在 ] 实践 中 得到 检验 、 批判 和 发展 , 并 最终 成为 世界性 的 政治 社会 文化 思潮 。 </s><s> 【 文件名 : \ 当代 \ CWAC \ ASM 0117 . </s><s> txt 文章 标题 : 作者 : 】 7355 : 第二 个 目标 : 要 让 每 个 女性 [",,在,"] 家 内 家 外 都 能 控制 自己 的 生活 与 身体 , 从而 获得 有 平等 、 尊严 和 自由 选择 的 权利 ; 【 文件名 : \ 当代 \ CWAC \ ASM 0117 . </s><s> txt 文章 标题 : 作者 : 】 735 6 : ( 1 ) [ 在 ] 美国 : 【 文件名 : \ 当代 \ CWAC \ ASM 0117 . </s><s> txt 文章 标题 : 作者 : 】 7357 : ( 2 ) [ 在 ] 欧洲 【 文件名 : \ 当代 \ CWAC \ ASM 0117 . </s><s> txt 文章 标题 : 作者 : 】",控制,verbs of activity,new,new,definite,Location<Theme,-3,inanimate,inanimate,place,concrete,uninversted sentence (PreLocPs),uninverted sentence,
327,"的 互动 来 建立 学习 共同体 意识 , 贯彻 '' 与 同伴 合作 "" 的 学习 理念 。 </s><s> 合作 学习 是 当今 世界 广泛 使用 的 一 种 有 创意 和 实效 的 课堂 教学 组织 形式 ( Baloche , 2006 ) , 目前 [ 在 ] 汉语 教学 课堂 上 还 使用 甚 少 。 </s><s> 第二 语言 教 学界 有 人 提出 过 '' 以 学生 为 中心 "" 的 口号 , 对 这 一 提法 , 我们 认为 应 采取 十分 谨慎 的 态度 。 </s><s> 实际上 , [ 在 ] 交际 活动 实施 过程 中 , 教师 [",,在,"] 课堂 上 , 仍 [ 在 ] 一定 程度 上 控制 着 教学 内容 和 教学 方法 。 </s><s> 如果 把 '' 以 学生 为 中心 "" 理解 为 , 课堂 教学 以 教师 所 精心 组织 的 语言 交际 活动 为 中心 , 发挥 学生 自主 学习 精神 , 启发 学生 之间 的 互动 , [ 在 ] 和谐 、 愉悦 的 气氛 中 完成 学习 任务 , 强调 学生 的 参与 意识 , 关注 学生 学习 差异 及 其 原因 , 主张 课堂 学习 活动 交际化 , 这些 理念 是 大多数 汉语 作为 第二 语言 教师 所 认可",控制,verbs of activity,new,given,indefinite,Location<Theme,-5,animate,inanimate,place,human,uninversted sentence (PreLocPs),uninverted sentence,
22,"。 [ 在 ] 武侠 小说 中 , 这 种 基础 就 是 内功 。 什么 是 内功 , 大概 金庸 也 不 大 明白 , 内功 尚且 可以 输出 输入 , 更 令 人 莫名其妙 。 但 内功 是 重要 的 。 你 看 , 杨过 与 小 龙女 [",,在," ] 古 墓 中 苦练 了 内功 , 所以 , 杨过 的 剑术 , 从 最 早 靠 好剑 , 发展 到 把 树枝 作剑 , 最后 进入 剑术 的 最高 层次 –– 无 剑 胜 有 剑 。 书中 的 各 路 高手 , 没有 一 个 不 是 身怀",苦练,verbs of activity,given,new,indefinite,Location>Theme,2,animate,inanimate,place,huaman,uninversted sentence (PreLocPs),uninverted sentence,
672,"<s> 她 搭上 火车 进城 , 胳膊 [ [ [",上,挎,"着 ] ] ] 她 的 两 身 衣裳 和 分到 的 两 块 光洋 , 手指 上 戴 着 银 戒指 。 </s>",挎,verbs of placement,new,given,definite,Location<Theme,-11,inanimate,animate,body-part,concrete,Locative inversion,Locative inversion,
744,"<s> txt 文章 标题 : 作者 : 】 3159 : 外乡人总是那么引人注目，鹤立鸡群，这往往使外乡人很难堪。但偶尔也会带来荣耀，那是在八角街大肆采购时，脖子 上 挂 着 项链 , 臂 上 缠 着 佛珠 , 手 上 戴 满 戒指 , 腰[[[",上,挎,着 ] ] ] 藏刀 。 </s>,挎,verbs of placement,new,given,indefinite,Location=Theme,,inanimate,animate,body-part,concrete,Locative inversion,Locative inversion,
477,"<s> 1955年1月下旬的某个雨夜,一个瘦高个儿的男子闯进了塔什干的一所医院.值班医生薇拉本想干预,但发现此人病情严重,所以破例让他立即住院.这个男子名叫科斯托格洛托夫,今年34岁,因胃癌转移获准从流放地来此就医.入院后,他在医生精心治疗下,病情奇迹般地得到了控制.2月 初 , 病房 [ [ [",里,来,"了 ] ] ] 一 个 名叫 卢萨诺夫 的 新 病人 , 是 当地 工业 管理局 的 干部 . </s>",来,verbs of motion,new,new,indefinite,Location<Theme,-9,animate,inanimate,place,human,Locative inversion,Locative inversion,
479,<s> 猪圈里，一头高大的母猪正在给它13个小猪崽喂奶。当 它 发现 自己 的 王国 [ [ [,里,来,"了 ] ] ] 一 个 女孩 , 就 本能 地 站 起来 , 龇 着 牙 , 流 着 口水 呜呜 地 叫 ...... 然而 小女 ... 【 文件名 : \ 当代 \ 报刊 \ 作家 文摘 \ 1996\1996A.TXT 文章 标题 : 回归 人类 的 猪 女 作者 : 】 35 1 92 : ... 乾 无法 阻止 , 因为 他 知道 , 如果 把 她 拴在 屋 里 , 小孩子 会 被 饿死 。 </s>",来,verbs of motion,new,given,indefinite,Location>Theme,2,animate,inanimate,place,human,Locative inversion,Locative inversion,
44,", 确 已 走 [ 在 ] 欧洲 前面 了 。 </s><s> 可是 , 欧洲 许多 国家 [ 在 ] 那 种 过渡 阶段 后 , 很 快 就 走上 了 现代化 旅程 , 一 个 特殊 的 士宦 阶层 , 根本 就 不 会 立足 。 </s><s> 反之 , 中国 贵族 支配 的 封建 社会 瓦解 后 , 代之而起 的 却 是 一 个 官僚 支配 的 封建 社会 。 </s><s> 惟其 还 是 封建 的 , 它 对于 商业 、 高利 贷业 就 不 能 不 时常 持 着 一 种 戒心 , 惟其 那 种 封建制 不 是 立 [",,在,"] 领主 经济 基础 上 , 而 是 立 [ 在 ] 地主 经济 基础 上 , 它 又 实 [ 在 ] 无法 阻止 商人 不 作 地主 , 士宦 不 特殊 地 过 着 一 种 "" 自由 的 "" 经济 生活 。 </s><s> 【 文件名 : \ 当代 \ CWAC \ APB0063 . </s><s> txt 文章 标题 : 作者 : 】 3863 : 而且 , 实行 地主 经济 的 结果 , 国家 要 把 以 赋税 方式 获 有的 大量 农产物 , 变为 商品 、 货币 、 俸给 及 其他 开支 。 </s><s> 那 不但 使 私人 商品 货币 经济",立,verbs of creation,given,new,definite,Location>Theme,3,inanimate,inanimate,nonconcrete,nonconcrete,uninversted sentence (PostLocPs),uninverted sentence,
187,", 是 可以 解释 的 。 </s><s> 这 种 可解释性 , 称作 理据 或 字理 , 表现 为 用意 符来 , 用 声符 来 表音 。 </s><s> 但是 , [ 在 ] 汉字 发展 的 过程 中 , 由于 字形 和 语音 、 字义 方面 的 变化 , 却 有 很多 意符 和声 符 失去 了 表意 和 表音 的 作用 , 也 就 是 失去 了 构字 理据 , 变成 了 记号 字 , 即 字形 结构 不 能 体现 出 音义 的 字 。 </s><s> 例如 : "" 立 "" 字 本 作 "" ! "" </s><s> , 像 人 立 [",,在,"] 地 上 , "" �K "" 字 ( 现 已 并 人 "" 并 "" 字 ) 本作 , 像 两 个 人 并立 [ 在 ] 地上 , 演变 成 隶书 、 楷书 之后 , 就 变成 了 不 能 分析 的 记号 字 了 。 </s><s> "" 特 "" 本义 是 公牛 , 以 "" 牛 "" 作 形旁 , "" 寺 "" 作声 符 , 由于 其 本义 早 已 不 用 , "" 寺 "" 的 表音 作用 也 已经 由于 语音 演变 而 丧失 , 故 对 一般 人 来说 , 这 个 字 实际上",立,verbs of posture,given,new,indefinite,Location>Theme,2,animate,inanimate,place,human,uninversted sentence (PostLocPs),uninverted sentence,
46,在实践上，“新公共管理”运动注重用市场机制来改造政府或用企业家精神重塑政府，在公共物品和服务的提供上采用市场的方法（合同承包、代理、拍卖、招标等）或准市场的办法，并在公共机构以及政府组织中确立节约成本和提高效益的激励机制。这有积极的借鉴意义，因为市场机制的确是改善政府功能的一个基本手段，通过在政府管理中注入一些市场的因素，可以缩小政府缺陷的影响范围，使政府体制更灵活，并提高政府的工作效率。这也正是我国传统的政府管理中最缺乏的因素之一。 公共 管理 尤其是 行政 管理 [,,在," ] 许多 方面 可以 利用 市场 机制 。 例如 , 政府 的 某些 活动 ( 如 许可证 、 执照 的 发放 ) 可以 采用 拍卖 的 方式 ; 政府 的 办公 用品 可以 通过 招标 的 方式 购买 ; 公共 工程 可以 承包 给 私人 公司 ; 同 一 种 公共",利用,verbs of activity,given,new,indefinite,Location=Theme,1,inanimate,inanimate,nonconcrete,nonconcrete,uninversted sentence (PreLocPs),uninverted sentence,
197,"说明 了 袍哥 隐语 与 江湖 话 的 关系 。 </s><s> 根据 语言学家 的 定义 , 暗语 ( 隐语 ) '' 不仅 借用 标准 的 主流 语言 , 而且 具有 不同 社会 环境 、 不同 社会 团体 的 行话 的 因素 "" 1 。 </s><s> 不过 应该 指出 的 是 , 当 傅崇矩 编撰 〈 诚 都 通览 》 寸 , 袍哥 为 非法 的 、 清 政府 明令 查禁 的 组织 。 </s><s> 傅崇矩 作为 一 个 改良 精英 , 把 袍哥 黑话 列入 江湖 话 一 类 , 有 其 政治 动机 。 </s><s> 把 袍哥 与 江湖 盗贼 等 列 [",,在,"] 一起 , 与 官方 关于 袍哥 的 话语 一致 。 </s><s> 不过 他 始料未及 的 是 , 不过 几 年 之后 , 袍哥 成为 倾覆 清朝 的 主要 力量 之一 , 并 [ 在 ] 辛亥 革命 后 一度 得以 公开 活动 。 </s><s> 【 文件名 : \ 当代 \ CWAC \ AHJ0027.txt 文章 标题 : 作者 : 】 1725 : 语言学家 把 隐语 定义 为 "" 由 某些 特定 的 行业 或 秘密 社会 "" 所 使用 的 方言 , 这 种 语言 '' 不 为 外人 所 理解 "" , 但 它 又 '' 区别 于 其他 私语 ''",列,verbs of placement,given,new,definite,Location<Theme,-5,animate,inanimate,place,human,uninversted sentence (PostLocPs),uninverted sentence,
542,"<s> txt 文章 标题 : 作者 : 】 121 26 : ...8点 到 8点10分 之间 , 19 个 人 慢慢悠悠 地 迈进 大门 , 其中 3 人手 [ [ [",里,拎,着 ] ] ] 油饼 、 豆浆 等 。 </s>,拎,verbs of holding or containing,new,new,indefinite,Location=Theme,-1,inanimate,animate,body-part,concrete,Locative inversion,Locative inversion,
139,调查还显示，小学生家长外出打工的比初中生家长外出打工的多，而小学低年级学生的家长外出打工又比高年级家长外出打工的多。大部分 有 未成年 子女 的 外出 务工者 将 子女 留 [,,在,"] 老家 生活 和 学习 , 但 一般 来 说 , 他们 都 会 [ 在 ] 外出 之前 对 子女 作 一 个 让 自己 比较 放心 的 安排 。 </s><s> 大多数 父母 双方 都 外出 务工者 都 有 老人 [ 在 ] 老家 帮助 他们 监护 未成年 子女 , 如果 没有 长辈 帮助 , 他们 一般 都 会 有 一 方 留 [ 在 ] 老家 照顾 自己 的 孩子 。 </s><s> 只 有 极 少数 的 进城 务工者 会 将 自己 的 孩子 托付 给 可以 信赖 的 亲戚 照管 。 </s><s> 也 有 极 少数 对 子女 安排 未",留,verbs of placement,given,new,definite,Location=Theme,1,animate,inanimate,place,human,uninversted sentence (PostLocPs),uninverted sentence,
157,"... 【 文件名 : \ 当代 \ CWAC \ APT0080. txt 文章 标题 : 作者 : 】 6374 : [ 在 ] 这 种 私 制度 之下 , 最 坏 的 还是 他们 自己 心虚 , 要 替 自己 留 一 个 退步 。 这 个 退步 , 就 留 [",,在," ] 关 东三省 。 清 政府 把关 东三省 划成 禁地 , 不 许 中国人 出关 。 我们 已 讲 过 : 满洲人 是 吉林 长白山 外 松花江 畔 很 小 的 一 个 小 部族 , 满洲 并不 就 是 东三省 。 辽河 东西 两 岸 , 秦 以前 就 是",留,verbs of existence,given,new,definite,Location=Theme,1,inanimate,inanimate,place,nonconcrete,uninversted sentence (PostLocPs),uninverted sentence,
248,"法兰克福 社会 研究所 创建 于 1923年 , A . 希特勒 上台 后 曾 先后 迁往 日内瓦 、 巴黎 , 第二 次 世界 大战 爆发 后 迁往 纽约 。 1950年 , 部分 成员 返回 联邦 德国 重建 研究所 , 部分 成员 仍 留 [",,在," ] 美国 继续 从事 社会 政治 理论 研究 。 霍克海默 19 30 ~ 1958年 任研究所 所长 , 并 于 1932年 创办 《 社会 研究 杂志 》 ( 19 32 ~ 1941 ) 。 参加 研究所 工作 的 有 哲学家 、 社会学家 、 经济学家 、 历史学家 和 心理学家 。 除",留,verbs of existence,given,new,indefinite,Location=Theme,-1,animate,inanimate,place,human,uninversted sentence (PostLocPs),uninverted sentence,
375,在任何一个阶级社会里面，把握着社会物质基本生产手段的阶级，同时必定要占有或支配社会基本的精神生产手段。这已经很明显的表现为一个法则。社会基本的精神生产手段被把握着：那第一，将可能使不合理的物质生产手段的占有，逐渐取得合理的依据；第二，将藉此继续制造出或生产出维护那种占有的动力；第三，将用以缓和或团结同一支配阶级内部的分离力量。所以，就中国历代王朝统治的经历讲，它们对于精神生产手段的把握是否牢固，运用是否得宜，颇有关于它们历史命运的修短，虽然在实质上，它们的存亡兴废，根本的还是看它们对于物质的基本生产手段的把握方面是否发生了破绽或动摇。在西周之世，世卿世禄，子就父学，世世相承，一切精神传授的手段，通在官府。 当时 农业 劳动 生产力 尚 因 铁 耕 未 行 而 留 [,,在,"] 极 低 阶级 , 剩余 劳动 生产物 有限 , [ 在 ] 官府 的 精神 生产 活动 便 受到 限制 , 一般 人民 更 无 此 "" 清福 "" 了 。 </s><s> "" 不识 不 知 , 顺天 之 则 "" , 原来 是 贵族 统治 的 安稳 场面 。 </s><s> 但 "" 自 老聃 写 书 征藏 , 以 贻孔氏 , 然后 竹帛 下庶人 。 </s><s> 六 籍 既定 , 诸书复 稍 出 金匮石室 间 。 </s><s> 民 以 昭苏 , 不 为 徒役 ; 九 流 自 此 作 , 世卿 自此堕 。 </s><s> 朝 命 不 擅威于 肉食 , 国史 不",留,verbs of existence,new,new,definite,Location<Theme,-2,inanimate,inanimate,nonconcrete,nonconcrete,uninversted sentence (PostLocPs),uninverted sentence,
882,"<s> 他 有 浓厚 的 眉毛 , 腮帮 [ [ [",上,留,"着 ] ] ] 一 大 片 黑 胡须 , 眼睛 不 凹 , 下颏 突出 , 在 那样 的 面貌 上 , 有 一 种 说 不 出 ... 【 文件名 : \ 当代 \ 翻译 作品 \ 文学 \ 悲惨 世界 . </s>",留,verbs of existence,new,given,indefinite,Location<Theme,-3,inanimate,animate,body-part,concrete,Locative inversion,Locative inversion,
283,", 汉族人 学 鲜卑语 不 是 当时 的 主流 , 而且 被 人 讥笑 为 "" 不 得 邯郸 之 步 而 有 匍匐 之 嗤 者 , 此 犹 其 小者 耳 "" ( 《 抱朴子・讥惑 》 ) , 而 鲜卑 等 族 学习 汉语 则 是 当时 不 可 阻挡 的 历史 潮流 。 </s><s> 【 文件名 : \ 当代 \ CWAC \ ALT0049. txt 文章 标题 : 作者 : 】 3281 : [ 在 ] 双语 现象 阶段 , 必然 会 产生 语言 间 的 相互 影响 , 即使 是 被 替代 的 语言 , 也 会 [",,在,"] 胜利者 的 语言 中 留下 自己 的 痕迹 。 </s><s> 可惜 汉字 不 是 拼音 文字 , 历史 上 的 这 种 痕迹 今天 已 不 甚 清楚 , 但 《 颜 氏 家训・音辞 》 篇 概述 当时 的 汉语 已经 "" 南染 吴越 , 北杂 夷虏 "" , 也 可 见 其一斑 。 </s><s> 很多 地名 容易 留下 被 替代 语言 的 痕迹 , 例如东 ... 【 文件名 : \ 当代 \ CWAC \ ALT0049. txt 文章 标题 : 作者 : 】 3282 : 文字 是 记录 语言 的 工具 , 双语 现象 时期 语言 间 的 相互 影响 也",留下,verbs of image,new,new,indefinite,Location>Theme,2,inanimate,inanimate,nonconcrete,nonconcrete,uninversted sentence (PreLocPs),uninverted sentence,
284,"尼泊尔 : 污染 已经 升至 世界 的 最高峰 , 登山者 [",,在," ] 喜玛拉雅 山上 留下 了 足迹 , 成吨 的 垃圾 也 开始 包围雪峰冰顶。",留下,verbs of image,new,new,indefinite,Location>Theme,5,inanimate,inanimate,place,nonconcrete,uninversted sentence (PreLocPs),uninverted sentence,
754,"<s> txt 文章 标题 : 作者 : 】 366 17 : ... 难 当 , 宝仁 不 能 像 正常人 那样 用 手 挠 , 只有 背对 着 墙壁 来回 蹭 , 墙壁 [[[",上,留下,了 ]]] 使 人 目不忍睹 的 斑斑 血迹 。 </s>,留下,verbs of existence,new,given,indefinite,Location<Theme,-8,inanimate,inanimate,concrete,concrete,Locative inversion,Locative inversion,
819,"<s> txt 文章 标题 : 作者 : 】 7383 : 由于 长年 戴 安全帽 , 他 的 前额 [ [ [",上,留下,了 ] ] ] 一 道 深杠 。 </s>,留下,verbs of existence,new,given,indefinite,Location=Theme,1,inanimate,animate,body-part,concrete,Locative inversion,Locative inversion,
881,<s> txt 文章 标题 : 作者 : 】 12417 : 它 的 身[[[,上,留下,了 ] ] ] 五 颗 罪恶 的 子弹 。 </s>,留下,verbs of existence,new,given,indefinite,Location<Theme,-3,inanimate,animate,body-part,concrete,Locative inversion,Locative inversion,
434,<s> 中国历史上，发生过多次利用道教，组织农民起义的壮举。最早一次农民起义的领袖，就是道教创始人之一的张角。东汉末年，政治腐败，加上连年水旱灾荒，广大农民实在没法生活下去了。这时 民 [ [ [,间,流传,"着 ] ] ] 一 首 歌谣 : "" 苍天 已 死 , 黄 天 当立 , 岁 在 甲子 , 天 下 大吉 。 "" </s>",流传,verbs of (dis)appearance,new,new,indefinite,Location<Theme,-18,inanimate,inanimate,place,nonconcrete,Locative inversion,Locative inversion,
463,"<s> 统计还显示,非洲自1982年发现首例艾滋病患者以来,累计已有近千万人死亡。其中,在2002年,非洲死于艾滋病的人数达到230万,新增感染者350万。统计显示,博茨瓦纳是世界上艾滋病病毒感染者比例最高的国家,每100个人中,就有大约38人是艾滋病患者或艾滋病病毒携带者。在东非的肯尼亚,每天约有500多人被艾滋病夺走生命。在非洲南部的津巴布韦,每周约有2500人死于艾滋病。因此 , 非洲民 [ [ [",间,流传,"着 ] ] ] 这样一句话:如果你在这里听说某人一星期内参加三次葬礼,一点也不要感到奇怪。",流传,verbs of (dis)appearance,new,given,definite,Location<Theme,-30,inanimate,inanimate,place,nonconcrete,Locative inversion,Locative inversion,
