Index,left,Localizers,"zai 'at, in'",right,verb,Verb class,Newness_Theme,Newness_Location,definiteiniteness_Theme,Heaviness,Heaviness_differences,Animacy_Theme,Animacy_Location,Animacy_Location_minorClass,Animacy_Theme_minorClass,Construction_trichotomy,Construction,备注: 住(驻扎，驻)有关的词都从posture变成existence
14,"1997 时 , 他 曾以史 上 最 高票 的 记录 , 被 选为 美国 心理学 协会 的 主席 。 </s><s> 【 文件名 : \ 当代 \ CWAC \ APE0086. txt 文章 标题 : 作者 : 】 4573 : ...社 , 1995 ) . </s><s> 他 最 新 的 著作 乃 是 个人 优点 和 美德 : 一 本 手册 和 解释 , 由 Christopher Peterson ( 2004年 牛津 大学 毕业生 ) 协助 撰写 。 </s><s> 他 的 著作 已经 被 翻译 成 超过 20 种 语言 , 无论是 美国 或是 国外 都 [ 在 ] 热卖 。 </s><s> 他 的 研究 , 曾经 [",,在,"] 许多 媒体 被 报导 过 , 其中 包括 纽约 时报 , 时代 杂志 , 每 周 新闻 , 美国 新闻 以及 世界 报告 等 , 读者 文摘 , 红 本子 , 双亲 杂志 , 财富 杂志 , 家庭 圈子 , 美国 今日报 , 以及 其他 许多 著名 的 媒体 杂志 。 </s><s> 他 也 多 次 [ 在 ] 电视 以及 电台 上 , 担任 积极 心理学 领域 里 研究 和 报告 的 发言人 。 </s><s> 他 的 文章 内容 所 提到 的 领域 有 教育 , 暴力 , 幸福 , 以及 治疗 。 </s><s> 他 也 曾经 旅游 世界 , 为",(被）报导,verbs of activity(passive),given,new,definite,Location=Theme,1,inanimate,inanimate,organization,nonconcrete,uninversted sentence (PreLocPs),uninverted sentence,
216,"政府 与 工人 组织 之间 的 中介 。 </s><s> 第二 , 考察 茶馆 [ 在 ] 人们 交往 和 社区 或 邻里 生活 中 所 扮演 的 角色 , 考察 不同 的 社会 集团 、 行业 、 性别 怎样 利用 茶馆 达到 各自 的 目的 。 </s><s> 各 种 社会 集团 利用 茶馆 从事 经济 、 社会 、 文化 活动 。 </s><s> 他们 以 茶馆 为 市场 , [ 在 ] 那里 做 大小 交易 ; 以 茶馆 为 舞台 , 提供 和 得到 娱乐 。 </s><s> 第三 , 通过 分析 茶馆 里 的 冲突 、 控制 、 权力 斗争 , 揭示 政治 [",,在,"] 茶馆 中 是 怎样 被 展现 出来 的 。 </s><s> 政治 的 变化 总 是 清楚 地 反映 [ 在 ] 茶馆 中 , 茶馆 成为 一 个 政治 舞台 , 成为 国家 和 地方 政治 演变 的 一 个 风向标 。 </s><s> 政府 以 维持 公共 秩序 为 理由 , 颁布 了 许多 控制 茶馆 的 规章 。 </s><s> 抗战 以及 随后 的 内战 时期 , 国家 和 各 种 社会 力量 利用 茶馆 为 其 政治 目的 服务 , 更 是 达到 了 前所未有 的 程度 。 </s><s> 诸多 政治 的 新 因素 都 影响 到 茶馆 里 的 日常 生活",(被）展现,verbs of activity(passive),new,given,indefinite,Location>Theme,2,inanimate,inanimate,place,nonconcrete,uninversted sentence (PreLocPs),uninverted sentence,
74,包装物是指企业在生产经营活动中为包装本企业产品（或商品、下同）而储备的各种包装容器。下列 各 项 [,,在, ] 会 计上 不 作为 包装物 进行 核算 : 各 种 包装 材料 ; 用于 储存 和 保管 产品 、 材料 而 不 对 外 出售 的 包装物 ; 计划 上 单独 列作 企业 产品 的 自制 包装物 。 【 文件名 : \ 当代 \ CWAC \ CAM 0131 . txt,（进行）核算,verbs of activity(passive),new,new,definite,Location=Theme,,inanimate,inanimate,nonconcrete,nonconcrete,uninversted sentence (PreLocPs),uninverted sentence,
725,"<s> txt 文章 标题 : 作者 : 】 26797 : .商会外有高大门楼，拾级而上，门洞两侧左有传达处，右为会客室，紧挨大门口是露着灯光的汽车房。商会毗邻 大多 是 居民 和 小商 店铺 , 二十 米 外 驻有 一部分 警察 , 丈高 的 大门 顶 [[[",上,安,"着 ] ] ] 个 乳白色 球形 的 灯泡 , 上 写 三 个 红字 "" 派出所 "" 。 </s>",安,verbs of attachment,new,given,indefinite,Location<Theme,-2,inanimate,inanimate,concrete,concrete,Locative inversion,Locative inversion,
329,"<s> txt 文章 标题 : 作者 : 】 206 98 : 兵库县 神户市 的 六 甲 岛 , 有 100 家 示范 住宅 的 屋顶 [[[",上,安装,"了 ] ] ] 太阳能 电池 , 当地 政府 和 有关 方面 正在 研究 如何 使 普通 家庭 利用 太阳能 ... 【 文件名 : \ 当代 \ 报刊 \ 人民 日报 \ 1993年 人民 日报 \ 3月份 . </s>",安装,verbs of attachment,new,new,indefinite,Location>Theme,5,inanimate,inanimate,concrete,concrete,Locative inversion,Locative inversion,
330,<s> 【 文件名 : \ 当代 \ 报刊 \ 作家 文摘 \ 1994 \ 1994B.TXT 文章 标题 : 老舍 一生 的 重大 抉择 作者 : 】 56945 : 记者手里的摄影灯，直到１９７４年春天，通过江青推荐，才在毛泽东 会见 外宾 的 书房 [ [ [,里,安装,了 ] ] ] 固定 摄影 灯 。 </s>,安装,verbs of attachment,new,new,indefinite,Location>Theme,6,inanimate,inanimate,place,concrete,Locative inversion,Locative inversion,
500,<s> TXT 文章 标题 : 作者 : 】 4987 : 如果 家 [[[,里,安装,"了 ] ] ] 录音 电话 , 即使 外出 , 也 不要紧 , 录音 电话 会 将 外面 打来 电话 的 内容 ... 【 文件名 : \ 当代 \ 应用文 \ 自然 科学 \ 中国 儿童 百科全书 . </s>",安装,verbs of attachment,new,new,indefinite,Location<Theme,-2,inanimate,inanimate,place,concrete,Locative inversion,Locative inversion,
585,"<s> 开车了，司机啪啪摁几下键，４９００吨的超长大列便平稳启动了，并很快加速。想当年我们撅着屁股汗流浃背地烧火涨汽，得猛干一气才行呢！落雪了，副司机拧大热风机，顿觉暖意融融，雪花还未落在玻璃上就化了。司机 还 告诉 我 , 现在 车 [ [ [",上,安装,"了 ] ] ] "" 黑匣子 "" , 引进 了 先进 的 四 显示 信号 , 安全 系数 比 原先 不 知 大 了 多少 ... 【 文件名 : \ 当代 \ 报刊 \ 人民 日报 \ 1995年 人民 日报 \ 5月份 . </s>",安装,verbs of attachment,new,given,indefinite,Location=Theme,-1,inanimate,inanimate,concrete,concrete,Locative inversion,Locative inversion,
94,"( 3 ) 如果 点 E [ 在 ] 棱 AD 或 棱AA , 上 运动 时 , 截面 S何 形状 ? </s><s> 【 文件名 : \ 当代 \ CWAC \ AET0017.txt 文章 标题 : 作者 : 】 1170 : 从 图 4.3 中 可以 清楚 地 看到 , 当 截面 中线 段 EF&gt; 0 的 时候 , 截面 EFBXDX 是 一 个 梯形 , 而 当 线段 EF=0 时 , 截面 ? </s><s> FBiDi 就 成为 一 个 三角形 。 </s><s> [ 在 ] 图 4.1 中 按下 "" 变化 "" 按钮 后 , 截面 发生 了 连续 变化 , 只要 [",,在,"] 屏幕 的 任意 位置 按 一下 鼠标 , 截面 就 会 [ 在 ] 最新 变化 的 位置 上 停住 , 如 图 4.3 中 的 ( a ) 、 ( b ) 、 ( c ) 和 ( d ) 。 </s><s> 【 文件名 : \ 当代 \ CWAC \ AET0017.txt 文章 标题 : 作者 : 】 1171 : 图 4.6 是 点击 显示 中线 以后 出现 的 界面 。 </s><s> [ 在 ] 原来 的 三角形 上 已经 增加 了 三 条 中线 , 新 出现 的 黑色 文字框 中 显示 对 "" "" 中线 "" 的 解释 ,",按,verbs of activity,new,new,indefinite,Location>Theme,6,inanimate,inanimate,concrete,concrete,uninversted sentence (PreLocPs),uninverted sentence,
230,"资本主义社会由于缺乏一种来自空洞信仰和干枯宗教的文化，便反过来把要求'解放'的文化大众的生活方式当做自己的规范，然而，这种文化对所有实际经验都无法给予确定的道德或文化指导。""（《资本主义文化矛盾》第195-196页）连布热津斯基也看到，""美国显然需要花一段时间，在哲学上进行反省和文化上作自我批判。在这一时期内必须认真地认识到：以相对主义的享乐至上作为生活的基本指南，是构不成任何坚实社会支柱的；一个社会没有共同遵守的绝对确定的原则，相反却助长个人的自我满足，那么，这个社会就有解体的危险。""（《失去控制：21世纪前夕的全球混乱》，第125页，中国社会科学出版社1995年7月版）然而事实表明，以自我为中心去涤荡形而上学的信仰，其结果必定使个人丧失精神家园，成为一个无家可归的文化漂泊者。当代这种全球性的精神危机，在资本主义条件下是找不到出路的。我们在建立社会主义市场经济的过程中，遇到了同样的挑战。个人主义、拜金主义和享乐主义的日益泛滥，向我们敲响了建设精神家园的警钟。 应当 说 , 社会主义 制度 使得 我们 [ 在 ] 这 方面 具有 优势 。 我们 的 制度 决定 了 我们 不 把 个人 利益 和 个人 意志 摆 [",,在," ] 压倒 一切 的 中心 地位 上 , 而 是 以 人民 的 利益 和 广大 群众 的 意志 为 转移 。 因此 , 社会主义 的 最高 价值 是 为 人民 服务 , 并 因而 奠立 了 理想 、 情操 和 精神 生活 的 基础 。 社会主义 并 不 简单 地",摆,verbs of placement,new,new,definite,Location>Theme,2,inanimate,inanimate,nonconcrete,nonconcrete,uninversted sentence (PostLocPs),uninverted sentence,
397,"<s> 皇上从漪澜堂上龙舟渡到了对面五龙亭，看过了小西天，然后到万佛楼上进御膳。一 进门 , 看见 院子 [ [ [",里,摆,"着 ] ] ] 两 桶 马蔺 , 皇上 心里 一动 , 想 拿 这个 找 刘墉 的 毛病 , 用 手 一 指 : "" 刘爱... 【 文件名 : \ 当代 \ 相声 小品 \ 中国 传统 相声 大 全 . </s>",摆,verbs of placement,new,new,indefinite,Location=Theme,-1,inanimate,inanimate,place,concrete,Locative inversion,Locative inversion,
399,"<s> 室内 有 一些 破旧 的 家具 : 一 张 四 方桌 , 一 个 长 条凳 , 靠 角落 [ [ [",里,摆,着 ] ] ] 一 张 床 。 </s>,摆,verbs of placement,new,new,indefinite,Location=Theme,1,inanimate,inanimate,place,concrete,Locative inversion,Locative inversion,
400,"<s> txt 文章 标题 : 作者 : 】 3539 : 农行常州市分行营业部，今年３月份与郊区支行分开后, 新建 、 改造 了 10 个 分理处 , 6 个 储蓄所 , 全部 是 室 [ [ [",内,摆,"着 ] ] ] 电脑 , 室外 站 着 柜员机 , 新增 了 1500 个 对公 帐户 , 8 个 月 是 分开 前 ... 【 文件名 : \ 当代 \ 报刊 \ 1994年 报刊 精选 \ 12 . </s>",摆,verbs of placement,new,new,indefinite,Location=Theme,,inanimate,inanimate,place,concrete,Locative inversion,Locative inversion,
484,<s> 中国的菜本来讲究色、香、味，后来有人加了个型，即菜的外形、造型。这一加就有文章了，全国各地大搞形式主义。冷盆里摆出一条金鱼，一只蝴蝶，用萝卜雕成玫瑰，用南瓜雕成凤凰等等，厨师如果不会雕刻，那就上不了等级。某次有人请我吃饭， 席面 [ [ [,上,摆,"着 ] ] ] 一 只用 南瓜 雕成 的 凤凰 , 那 南瓜 是 生 的 ( 当然 是 生 的 ) , 不 能 吃 。 </s>",摆,verbs of placement,new,new,indefinite,Location<Theme,-7,inanimate,inanimate,concrete,concrete,Locative inversion,Locative inversion,
486,<s>他们吃过饭后天已经快黑了。邵红娇刷碗，亮铜就蹭到她住的屋子去。一进去他就闻到了一股温馨的气味，便以为屋子里栽了花，仔细看看，并无花，便有些奇怪。 炕 [ [ [,上,摆,"着 ] ] ] 一 床 蓝花布 的 棉被 , 两 个 圆鼓鼓 的 枕头 挨 在 被子 旁 。 </s>",摆,verbs of placement,new,new,indefinite,Location<Theme,-6,inanimate,inanimate,concrete,concrete,Locative inversion,Locative inversion,
488,"<s> TXT 文章 标题 : 一百 个 人 的 十 年 作者 : 】 23046 : ... 天 我 发现 了 这 家 商店 , 当时 它 过 了 营业 时间 , 锁 了 门 , 可 我 看 它 橱窗 [ [ [",里,摆,"着 ] ] ] 好几 只 多 桅帆船 , 标价 都 不 算贯 , 我 早 想 抱 只 西洋 风味 十足 的 多 桅帆船 ... 【 文件名 : \ 当代 \ 文学 \ 大陆 作家 \ 刘心武 短 篇 . </s>",摆,verbs of placement,new,new,indefinite,Location<Theme,-4,inanimate,inanimate,concrete,concrete,Locative inversion,Locative inversion,
490,"<s> txt 文章 标题 : 作者 : 】 4782 : 同公共卫生不良的情况成为鲜明对比的是，这里的家庭卫生是非常好的。走到 每 一 家 , 都 见到 门[[[",前,摆,着 ] ] ] 若干 双 拖鞋 。 </s>,摆,verbs of placement,new,new,indefinite,Location<Theme,-3,inanimate,inanimate,place,concrete,Locative inversion,Locative inversion,
578,<s> 女人：“小舅说他出村不远，就觉得天忽地变了，阴森森的，头顶上的星星一颗不见，一片糊黑，风也刮起来了，吹起砂石和树叶不住打他的脸。没过多会儿，他就迷路了，怎么也找不到两村中间那道河了。这时他看见黑暗中有一道亮光，就朝亮光走去，走到近前，看见一个人提着一盏灯笼站在那里，借灯笼的亮光，他看见提灯笼的人脸色煞白，像糊了张白纸，又像抹了一层白粉。他倒也没害怕，问：你在这儿等谁？白脸人说等你。他问：等我干哈？白脸人说是你爹叫我来领你。他虽然醉得不成样子，可心里还有一线清楚，想我爹不是死了么？怎么又回阳世了呢？没等他想明白，又听白脸人说跟着我，踏着我的脚窝走，一步不能偏，否则就到不了你爹那儿。说毕白脸人便打着灯笼朝前走去，他就紧跟着，照白脸人说的紧踏着他的脚窝走。他好生奇怪，白脸人走起路来一点声音都没有，身子轻得像在地面上飘。走了不到半个时辰，他看见前面出现了一座大房子，从门窗往外透出灯光。白脸人一直把他领到大房子前，对他说：“进去吧，你爹在里面。他就撇开白脸人向大房子走。刚踏进门槛，只听里面飘出声音：是回么？进来吧。小舅吓了一跳，回是他的小名，声音也听得真切，是我姥爷。他赶紧抬头，一眼看见姥爷坐在屋正中一张八仙桌旁，姥姥坐在姥爷对面。八仙桌 [ [ [,上,摆,"着 ] ] ] 许多 吃食 , 有 饽饽 、 饺子 、 鱼 、 肉 和 瓜果 梨枣 。 </s>",摆,verbs of placement,new,given,indefinite,Location=Theme,,inanimate,inanimate,concrete,concrete,Locative inversion,Locative inversion,
352,"<s> txt 文章 标题 : 作者 : 】 188 02 : 日记本 上 一 支 笔 "" 唰唰 "" 写完 了 最后 几 个 字 , 桌子 [ [ [",上,摆放,着 ] ] ] 张一凡 和 妈妈 的 合影 ( 高仓健 的 照片 没有 了 ) 。 </s>,摆放,verbs of placement,new,new,definite,Location<Theme,-6,inanimate,inanimate,concrete,concrete,Locative inversion,Locative inversion,
394,"<s> txt 文章 标题 : 作者 : 】 53 19 : 拉萨 八廓街 , 许多 人家 的 窗台 [ [ [",上,摆放,着 ] ] ] 一 盆 寸许 长 的 青稞 苗 。 </s>,摆放,verbs of placement,new,new,indefinite,Location=Theme,-1,inanimate,inanimate,concrete,concrete,Locative inversion,Locative inversion,
480,"<s> txt 文章 标题 : 作者 : 】 11498 : 在与中央大街垂直的3条辅街上,近1万平方米的范围内保留着欧洲风格建筑群落,分属于“文艺复兴式”、“巴洛克式”、“折衷主义”和“新艺术运动”等艺术流派。这些建筑群落多建于20世纪初期,里面曾一度居住着来自俄国、德国、法国、英国、意大利等国的侨民, 商店 的 厨窗 [ [ [",里,摆放,着 ] ] ] 俄国 的 毛皮 、 法国 的 香水 、 美国 的 洋油 以及 爪哇 的 砂糖 。 </s>,摆放,verbs of placement,new,new,indefinite,Location<Theme,-16,inanimate,inanimate,concrete,concrete,Locative inversion,Locative inversion,
481,"<s> 同时 , 市场 上 常常 能 发现 低劣 的 进口 影碟 , 书摊 [ [ [",上,摆放,"着 ] ] ] 以 暴力 、 色情 取胜 的 低级 畅销 译著 和 卡通 , 打 着 外国 标志 的 "" 保健 药品 ... 【 文件名 : \ 当代 \ 报刊 \ 新华社 \ 新华社 2002年 3月份 新闻 报道 . </s>",摆放,verbs of placement,new,new,indefinite,Location<Theme,-14,inanimate,inanimate,concrete,concrete,Locative inversion,Locative inversion,
485,"<s> txt 文章 标题 : 作者 : 】 1658 : 这天，元隆 商行 红灯 高挂 , 彩幅 高悬 , 店堂 里 播放 着 美国 的 歌曲 , 货架 拒 台 [ [ [",上,摆放,"着 ] ] ] 具有 美国 消费 特色 的 商品 , 导购 小姐 、 导购 先生 身披 烫金 大红 绶带 , 笑 ... 【 文件名 : \ 当代 \ 报刊 \ 1994年 报刊 精选 \ 06 . </s>",摆放,verbs of placement,new,new,indefinite,Location<Theme,-6,inanimate,inanimate,concrete,concrete,Locative inversion,Locative inversion,
494,"<s> 杨增建是在拉萨打工的四川人,他租的两间平房虽有些简陋,但院内挂着的红灯笼和房门上贴着的对联,都为节日增添了不少喜庆的气息。客厅 的 方木桌 [ [ [",上,摆放,"着 ] ] ] 糖果 和 饮料 , 电视 里 播放 着 春节 联欢 晚会 , 厨房 里杨 增建 全家人 与 亲朋 ... 【 文件名 : \ 当代 \ 报刊 \ 新华社 \ 新华社 2003年 2月份 新闻 报道 . </s>",摆放,verbs of placement,new,given,indefinite,Location>Theme,2,inanimate,inanimate,concrete,concrete,Locative inversion,Locative inversion,
495,<s> ７时整，红十字会采血人员准备工作就绪。志愿献血者分批进入电台门厅，称体重、量身高，填个人资料表格。走上二楼，记者看到二楼办公室全部腾空，临时改成了采血病房、大夫诊室和休息室。９间“临时病房”里各安放了两三张供采血用的活动病床，休息室 [ [ [,里,摆放,"着 ] ] ] 沙发 , 备有 牛奶 、 面包 等 食品 。 </s>",摆放,verbs of placement,new,given,indefinite,Location>Theme,2,inanimate,inanimate,place,concrete,Locative inversion,Locative inversion,
530,"<s> txt 文章 标题 : 作者 : 】 305 6 : ... 悼 会场 庄严 肃穆 , 两 位 烈士 的 灵柩 上 覆盖 着 中华 人民 共和国 国旗 , 两 [ [ [",旁,摆放,着 ] ] ] 中国国防部、中国人民解放军总参谋部和我驻柬全国最高委员会代表处及我驻柬各机构的花圈。,摆放,verbs of placement,new,given,definite,Location<Theme,-37,inanimate,inanimate,place,concrete,Locative inversion,Locative inversion,
696,"<s> txt 文章 标题 : 作者 : 】 188 69 : 周国 正 家 的 院子 里 摆 了 许多 小凳子 和 一 张 低矮 的 老式 农家 饭桌 , 饭桌 [ [ [",上,摆放,"着 ] ] ] 两 个 暖瓶 和 十几 个 玻璃 茶杯 , 丁元英 的 烟 和 打火机 放 在 饭桌 的 一 角 。 </s>",摆放,verbs of placement,new,given,indefinite,Location<Theme,-9,inanimate,inanimate,concrete,concrete,Locative inversion,Locative inversion,
703,<s> txt 文章 标题 : 作者 : 】 73 14 :在一个供6—12岁儿童参观活动的“科学发现室”里，墙壁和展台上展出许多实物标本，如大鳄鱼皮、蟒蛇、人体骨骼、牛骨骼、鸟、大鱼等；展台上还有潜艇模型、太阳系模型、计算机、古旧的管风琴、鼓等多种多样的收藏品; 地 [ [ [,上,摆放,"着 ] ] ] 大 磁铁 、 105 个 年轮 的 大 木头 、 石英石 、 一 条 捕 龙虾 的 小船 , 真 可 谓 ... 【 文件名 : \ 当代 \ 报刊 \ 人民 日报 \ 2000年 人民 日报 \ 2000年 人民 日报 . </s>",摆放,verbs of placement,new,given,indefinite,Location<Theme,-20,inanimate,inanimate,place,concrete,Locative inversion,Locative inversion,
707,<s> txt 文章 标题 : 作者 : 】 3900 : 训练局荣誉室陈列着革命前辈亲切接见运动员的照片和历代运动员为国争光的图片。荣誉室 [ [ [,内,摆放,着 ] ] ] 一 个 个 闪光 的 金杯 、 奖牌 。 </s>,摆放,verbs of placement,new,given,indefinite,Location<Theme,-6,inanimate,inanimate,place,concrete,Locative inversion,Locative inversion,
266,<s> txt 文章 标题 : 作者 : 】 16996 : 他 手 [ [ [,里,摆弄,"着 ] ] ] 笔 , 一时 没有 说话 。 </s>",摆弄,verbs of activity,new,given,indefinite,Location>Theme,2,inanimate,animate,body-part,concrete,Locative inversion,Locative inversion,
423,"<s> 自然环境的恶劣使这个革命老区长期以来经济落后。１９９２年全县农村人均收入仅４２６元，全县乡村有１０００多间“黑屋子、土台子”的教室，１１个乡镇有１／３的村子连校舍都没有。与教育落后相伴随的是人才和技术的匮乏。前 几 年 , 县 [ [ [",里,办,"了 ] ] ] 一 个 纱厂 , 可 连 一 个 中专 学历 的 人 都 没有 , 只好 到 外地 找 人才 、 找 技术 ... 【 文件名 : \ 当代 \ 报刊 \ 人民 日报 \ 1996年 人民 日报 \ 1月份 . </s>",办,verbs of activity,new,given,indefinite,Location<Theme,-2,inanimate,animate,organization,concrete,Locative inversion,Locative inversion,
104,"尚书省乃唐代中央政府组织最庞大的机构，其建筑亦相当庞大。总办公厅名为""都堂""，两旁为左右两厢，吏户礼三部在左，兵刑工三部在右。由左右仆射分领。每部分四司，六部共二十四司。每部之第一司即为本司，如吏部之第一司为吏部司是。其余各司各有名称。 尚 书 省 各 部 主管 , 上午 [",,在," ] 都 堂 集体 办公 , 遇事 易于 洽商 , 下午 各 归 本部 分别 办公 。 如 有 "" 参知 机务 "" 或 "" 同 平章 事 "" 衔 者 , 可 去 政事堂 出席 最高 政事 会议 。 无 此 等 衔者 , 则 专 [ 在 ] 本",办公,verbs of activity,given,given,definite,Location<Theme,-4,animate,inanimate,place,human,uninversted sentence (PreLocPs),uninverted sentence,
780,"<s> txt 文章 标题 : 作者 : 】 31793 : ... 个 是 张立根 , 粗粗 实实 的 中等 个 是 张金锁 , 都 反 穿 着 棉裤 、 棉袄 , 头 [ [ [",上,包,着 ] ] ] 白 毛巾 。 </s>,包,verbs of attachment,new,given,indefinite,Location=Theme,-1,inanimate,animate,body-part,concrete,Locative inversion,Locative inversion,
589,"<s> 自从 孩子 抱病 以后 , 自然 也 得分 一点 心 去 看护 , 黯黄 的 灯光 下 , 对着 ... 【 文件名 : \ 现代 \ 文学 \ 散文 2.TXT 文章 标题 : 心上 的 暗影 作者 : 】 24 267 : 不 耐烦 的 神气 [ [ [",里,包藏,"着 ] ] ] 一 颗 杀人 的 心 , 但 有 什么 办法 呢 ? </s>",包藏,verbs of holding or containing,new,given,indefinite,Location=Theme,1,inanimate,inanimate,nonconcrete,nonconcrete,Locative inversion,Locative inversion,
287,同义词的各个意义所概括反映的现实现象必须是相同的，或者基本上相同的。用图形表示，大体如1和2。 图 3 的 乙 包含 [,,在,"] 甲 里头 , 甲 和 乙 就 没有 同义 关系 。 </s><s> 这 就是说 , 指称 大 类 事物 的 词 和 指称 大 类 事物 中 某 一 小 类 的 词 , 例如 英语 的 "" man "" 和 "" boy "" , 汉语 的 "" 蔬菜 "" 和 "" 白菜 "" , 或者 指称 整体 的 词 和 指称 整体 中 的 一 部分 的 词 , 例如 汉语 的 "" 房子 "" 和 "" 屋子 "" , 都 不 是 同义词 。 </s><s> 词义 包含 理性 意义 和 附加 色彩 两 方面 。 </s><s> 同义词 的 "" 同",包含,verbs of holding or containing,new,new,definite,Location=Theme,,inanimate,inanimate,concrete,concrete,uninversted sentence (PostLocPs),uninverted sentence,
323,<s> 你读过莎士比亚的《暴风雨》吗？那 [ [ [,里,包含,着 ] ] ] 这 位 伟大 艺术家 的 全部 哲学 。 </s>,包含,verbs of holding or containing,given,given,definite,Location<Theme,-10,inanimate,inanimate,concrete,nonconcrete,Locative inversion,Locative inversion,
333,"<s> txt 文章 标题 : 作者 : 】 8584 : ... 销 理论 , 服务 是 商品 销售 的 重要 组成 部分 , 即 购买者 支付 的 商品 价格 [ [ [",里,包含,着 ] ] ] 一定 的 服务 费用 。 </s>,包含,verbs of holding or containing,new,new,indefinite,Location>Theme,4,inanimate,inanimate,nonconcrete,nonconcrete,Locative inversion,Locative inversion,
588,"<s> txt 文章 标题 : 作者 : 】 23522 : 比如，某种商品价格为１００元。旧 税制 情况 下 , 100 元 的 价格 [ [ [",内,包含,"了 ]]] 14·5 元 的 税款 , 即 商品 的 实际 价格 为 100 - 14·5=85·5... 【 文件名 : \ 当代 \ 报刊 \ 人民 日报 \ 1994年 人民 日报 \ 第1 季度 . </s>",包含,verbs of holding or containing,new,given,indefinite,Location=Theme,1,inanimate,inanimate,nonconcrete,nonconcrete,Locative inversion,Locative inversion,
764,<s> TXT 文章 标题 : 作者 : 】 933 : 动物 的 生存 竞争 使 它们 之 [ [ [,间,保持,"着 ] ] ] 自然 的 动态 平衡 , 这 对于 生物 的 进化 和 物种 的 延续 都 具有 重要 意义 。 </s>",保持,verbs of existence,new,given,indefinite,Location<Theme,-3,inanimate,inanimate,nonconcrete,nonconcrete,Locative inversion,Locative inversion,
312,"<s> txt 文章 标题 : 作者 : 】 10179 : 当地文化站站长陈晓阳介绍说,当年整个土司皇城共分为政治、宗教、军事、文化、经济、综合、娱乐和墓葬八大区域,建有衙署、官言堂、钱库、月台、书院、御花园、营房、宗祠等建筑,以及8大寺院、36箍井等。历经200多年的风雨侵蚀,村子里仍然可以看到部分建筑的地基围墙的遗迹,让人联想起当年土司城内民丁南来北往,大小商贾忙于作坊店馆之间的繁华景象。村 东边 唐崖 河岸 边 的 罩 马亭 [ [ [",里,保存,"着 ] ] ] 一 对 石人 、 石马 , 相传 是 土司 覃鼎 的 马夫 和 座 骑 , 其中 一 石 人人 头 虽 毁 ... 【 文件名 : \ 当代 \ 报刊 \ 新华社 \ 新华社 2002年 1月份 新闻 报道 . </s>",保存,verbs of placement,new,new,indefinite,Location>Theme,7,inanimate,inanimate,place,concrete,Locative inversion,Locative inversion,
