Index,left,Localizers,"zai 'at, in'",right,verb,Verb class,Newness_Theme,Newness_Location,definiteiniteness_Theme,Heaviness,Heaviness_differences,Animacy_Theme,Animacy_Location,Animacy_Location_minorClass,Animacy_Theme_minorClass,Construction_trichotomy,Construction,备注: 住(驻扎，驻)有关的词都从posture变成existence
293,但是倘若当时的领袖人物更新，更要进一步的接受西洋文化，社会能容许他们吗？社会一定要给他们更大的阻碍。他们所行的那种不彻底的改革已遭一般人的反对，若再进一步，反对一定更大。譬如铁路：光绪六年（一千八百八十年）李鸿章、刘铭传奏请建筑，到了光绪二十年还只建筑天津附近的一小段。为什么呢？因为一般人相信修铁路就破坏风水。又譬如科学: 同治 五 年 ( 一八六六年 ) 恭 亲王 [,,在,"] 同 文馆 添设 科学 班 , 请 外国 科学家 作 教授 , 招收 翰林院 的 人员 作 学生 。 他 的 理由 是 很 充足 的 。 他 说 买 外国 轮船 枪炮 不过 一时 权宜之计 , 治本 的 办法 [ 在 ] 于 自己 制造 。 但是 要 自己",添设,verbs of creation,new,new,indefinite,Location=Theme,1,inanimate,inanimate,place,nonconcrete,uninversted sentence (PreLocPs),uninverted sentence,
75,"纽约 ( 新约克 ) 是 著名 的 ; 伦敦 , 莫斯科 等 地名 [ 在 ] 美国 地图 上 都 找 得 到 , 而且 不止 一 个 。 以 我们 自己 来说罢 , 血缘性 的 地缘 更 是 显著 。 我 十 岁 离开 了 家乡 , 吴江 , [ 在 ] 苏州 城里 住 了 九 年 , 但是 我 一直 [",,在," ] 各 种 文件 的 籍贯 项下 填 着 "" 江苏 吴江 "" 。 抗战 时期 [ 在 ] 云南 住 了 八 年 , 籍贯 毫 无 改变 , 甚至 生 [ 在 ] 云南 的 我",填,verbs of image,given,new,definite,Location>Theme,6,inanimate,inanimate,concrete,concrete,uninversted sentence (PreLocPs),uninverted sentence,
200,"回答 你 一 个 大声 的 "" 我 "" 。 </s><s> 这 是 说 , 你 得 用 声气辨人 。 </s><s> [ 在 ] 面 对 面 的 社群 里 一起 生活 的 人 是 不 必 通名 报 姓 的 。 </s><s> 很少 太太 会 [ 在 ] 门 外 用 姓名 来 回答 丈夫 的 发问 。 </s><s> 但是 我们 因为 久习于 这 种 "" 我 呀 ! "" </s><s> "" 我 呀 ! "" </s><s> 的 回答 , 也 很 有时候 用到 了 门 内 人 无法 辨别 你 声音 的 场合 。 </s><s> 我 有 一 次 , 久别 家乡 回来 , [",,在,"] 电话 里 听到 了 一 个 无法 辨别 的 "" 我 呀 "" 时 , 的确 闹 了 一 个 笑话 。 </s><s> 【 文件名 : \ 当代 \ CWAC \ ASB 0100 . </s><s> txt 文章 标题 : 作者 : 】 66 30 : "" 贵 姓 大名 "" 是 因为 我们 不 熟悉 而 用 的 。 </s><s> 熟悉 的 人 大 可 不必 如此 , 足声 、 声气 、 甚至 气味 , 都 可以 是 足够 的 "" 报名 "" 。 </s><s> 我们 社交 上 姓名 的 不常 上口 也 就 表示 了 我们 原本 是 [ 在 ] 熟人",听到,verbs of activity,new,new,indefinite,Location<Theme,-5,inanimate,inanimate,concrete,nonconcrete,uninversted sentence (PreLocPs),uninverted sentence,
742,"<s> 当 一 天 晚上 侯 玉成 从 学校 回到 家 来 的 时候 , 他 就 看见 院 [ [ [",里,停,着 ] ] ] 一 顶 花轿 。 </s>,停,verbs of posture,new,given,indefinite,Location<Theme,-2,inanimate,inanimate,place,concrete,Locative inversion,Locative inversion,
817,<s> 但她只是拿着針线假裝在刺繡，那幅掛毯在完成后会非常漂亮。它描繪的是一个威嚴的騎士和他的随從騎着馬在盛夏的山崗上眺望接近的敵軍。但 手腕 [ [ [,上,停,"着 ] ] ] 獵鷹 的 騎士絲 毫 不 擔心 逼近 的 威脅 , 他 的 表情 几乎 像 是 在 放声 大笑 。 </s>",停,verbs of posture,new,given,indefinite,Location=Theme,1,animate,animate,body-part,animal,Locative inversion,Locative inversion,
740,"<s> 27日上午,警察继续封锁着发生枪击事件的议会大楼,不让任何无关人员和记者进入。楼门 [ [ [",外,停放,着 ] ] ] 6 辆 急救车 和 5 辆 警车 。 </s>,停放,verbs of posture,new,given,indefinite,Location<Theme,-7,inanimate,inanimate,place,concrete,Locative inversion,Locative inversion,
335,"由于 科技 的 投入 、 制度 法规 的 建设 、 行政 管理 的 调控 , 环境 保护 的 行动 取得 了 一定 成效 。 </s><s> 但 光 凭 技术 、 法律 、 行政 手段 就 能 解决 所有 问题 吗 ? </s><s> 为什么 今天 环保 成果 还 是 鲜 有 人 问 津 ? </s><s> 为什么 工业 企业 还是 不 愿 [ 在 ] 环保 设施 和 清洁 生产 工艺 上 投入 ? </s><s> 为什么 破坏 生态 环境 的 行为 还 屡 禁 不 止 ? </s><s> 知 之 浅薄 必然 导致 行 之 懵懂 。 </s><s> 对 人 的 生存 及 意义 仅 停留 [",,在,"] 浅薄 的 庸俗化 的 认知 上 , 必然 会 导致 这 种 只 顾 眼前 、 不 顾 将来 的 行为 , 因此 获得 新 层次 的 认知 是 环境 危机 不 可 缺少 、 甚至 根本 的 解决 之 道 。 </s><s> 只有 这 一 方面 的 问题 解决 了 , 人们 对 科技 的 漠视 才 会 有所 改变 , 对 法律 的 简单 畏惧 才 会 成为 内 [ 在 ] 的 心悦诚服 。 </s><s> 道德 上 的 启迪 是 人们 获得 深 层次 认知 的 重要 途径 , 道德 上 的 醒悟 才 是 人类 最 深刻",停留,verbs of posture,new,new,indefinite,Location>Theme,3,inanimate,inanimate,nonconcrete,nonconcrete,uninversted sentence (PostLocPs),uninverted sentence,
337,"他们对计算机(网络）的作用、合作学习的组织和监控、合作学习观念的建立等三个方面进行了严肃的思考和反省，认为目前的网上合作学习的实践中存在这样一些问题:夸大了计算机（网络)在合作学习中的作用，因而过分着重于对技术的研究。例如，只关注在网络应用中如何提供一种多元化的通信工具，而忽略了对学习者为什么要进行交流的原因研究;在合作学习的组织和监控上，存在一种“被动”和“赖惰”的组织现象, 对于 合作 的 管理 只 停留 [",,在," ] 建设 好 一 个 良好 的 合作 学习 环境 ( 即 创造 好 的 "" 物 ' 的 环境 ) 的 想法 上 , 对 学习者 [ 在 ] 合作 中 如何 "" 主动 "" 地 参与 并 进行 活动 ( 即 调动 "" 人 "" 的 因素 ) 的",停留,verbs of posture,new,new,indefinite,Location>Theme,12,inanimate,inanimate,nonconcrete,nonconcrete,uninversted sentence (PostLocPs),uninverted sentence,
513,<s> 1905年 这 [ [ [,里,通,"了 ] ] ] 火车 , 于是 有 了 第一 家 旅馆 , 旅客 只 需 花 一 美元 就 可以 享用 8 小时 的 木 ... 【 文件名 : \ 当代 \ 报刊 \ 人民 日报 \ 1996年 人民 日报 \ 1月份 . </s>",通,change of state,new,given,indefinite,Location=Theme,,inanimate,inanimate,place,concrete,Locative inversion,Locative inversion,
653,"<s> 全 县 乡镇 铺 了 柏油路 , 开通 了 程控 电话 , 村 [ [ [",里,通,"了 ] ] ] 电 , 广播 和 电视 覆盖率 达到 93.1% 和 95% , 全 县 非文盲率 达到 9... 【 文件名 : \ 当代 \ 报刊 \ 人民 日报 \ 1998年 人民 日报 \ 1998年 人民 日报 . </s>",通,change of state,new,given,indefinite,Location=Theme,1,inanimate,animate,organization,nonconcrete,Locative inversion,Locative inversion,
473,"几 世纪 以前 的 说法 , 就 会 闹 笑话 。 </s><s> 汉语 的 情况 有些 不同 。 </s><s> 词语 的 读音 虽然 古今 有别 , 但 文字 的 写法 却 是 一样 的 , 这 [ 在 ] 客观 上 便于 沟通 古今 。 </s><s> 加以 人们 崇尚 古代 的 典籍 , 古代 的 句式 和 词语 用法 通过 师生 传授 , 代代相传 , 一直 沿用 下来 。 </s><s> 新 的 作者 会 毫不犹豫 地 把 公元 前 的 词语 和 其后 若 干 世纪 产生 的 词语 一起 引用 , 口语 中 早 就 不 用 的 旧 词语 仍旧 可以 [",,在,"] 书面语 中 通行 无阻 。 </s><s> 例如 , "" "" "" "" "" 居心测 "" "" "" 等等 。 </s><s> 类似 的 现象 [ 在 ] 使用 拼音 文字 的 语言 中 是 少见 的 。 </s><s> 【 文件名 : \ 当代 \ CWAC \ ALT0049. txt 文章 标题 : 作者 : 】 3186 : 其次 , [ 在 ] 以 拼音 文字 为 书写 工具 的 语言 中 , 文字 反映 的 是 共同语 的 发音 , 书面语 可以 通过 教育 、 阅读 等 途径 对 口语 产生 很 大 的 影响 , 使 书面语 中 的 词语 穿 着 共同语",通行,verbs of motion,new,new,indefinite,Location<Theme,-7,inanimate,inanimate,nonconcrete,concrete,uninversted sentence (PreLocPs),uninverted sentence,
414,"教授 [ 在 ] 一 篇 未 刊 的 手稿 中 指出 的 : "" 中国 哲学家 都 是 不同 程度 的 苏格拉底 。 其 所以 如此 , 因为 道德 、 政治 、 反思 的 思想 、 知识 都 统一 于 一 个 哲学家 之 身 ; 知识 和 德性 [",,在," ] 他 身上 统一 而 不 可 分 。 他 的 哲学 需要 他 生活 于 其中 ; 他 自己 以 身 载道 。 遵守 他 的 哲学 信念 而 生活 , 这 是 他 的 哲学 组成 部分 。 他 要 做 的 事 就 是 修养 自己 , 连续地",统一,verbs of (dis)appearance,given,given,definite,Location=Theme,-1,inanimate,animate,body-part,nonconcrete,uninversted sentence (PreLocPs),uninverted sentence,
426,"<s> 10月25日凌晨，尚在梦乡的梁慧珉被骤然响起的门铃惊醒，她懵懵懂懂地披上外衣，起来开了门。门外是身着便装的二男三女。""我们是北京市国家安全局的。梁慧珉女士，您因为窃取国家机密，触犯了国家法律，我们决定对你拘留审查！” 为首 的 中年 男子 话语 [[[",里,透,着 ] ] ] 一 种 威严 。 </s>,透,verbs of emission,new,new,indefinite,Location>Theme,6,inanimate,inanimate,nonconcrete,nonconcrete,Locative inversion,Locative inversion,
527,"<s> 2792 : ... 不惑 之 年 的 汉子 , 长 得 人高马大 , 仪表堂堂 , 沉稳 中 含 着 机敏 , 大度 [ [ [",里,透,"着 ]]] 刚毅 , 只 有 那 日渐 稀疏 的 顶发 , 给 人 以 饱经沧桑 之 感 。 </s>",透,verbs of emission,new,new,indefinite,Location=Theme,1,inanimate,inanimate,nonconcrete,nonconcrete,Locative inversion,Locative inversion,
528,"<s> txt 文章 标题 : 作者 : 】 1987 : ... 只 是 一 位 60 岁 出头 的 老人 , 穿 着 极其 普通 , 眼 虽 花 而 耳 不 聋 , 随和 [[[",中,透,"着 ]]] 刚毅 , 慈祥 的 面容 里 泛溢 着 书卷 之 气 。 </s>",透,verbs of emission,new,new,indefinite,Location=Theme,1,inanimate,inanimate,nonconcrete,nonconcrete,Locative inversion,Locative inversion,
683,<s> 目前，准旗在裸露的砒砂岩上种植沙棘近60万亩，保存面积70％左右。今天，准旗正在把沙棘作为一项产业来抓，几个沙棘的深加工厂在建设中，产品包括药品、饮料等。在大路乡吞山口村的村头，远远就望见骄阳下有许多忙碌的身影，那是村民们正在挖水平沟、鱼鳞坑。53岁的村长郭二保指着身后的山头自豪地说：“从4月底到现在，我们挖了11万多个坑坑。”记者问还养羊吗？他笑着说，全是舍饲了。虽然舍饲养羊使得村里的牲畜头数下降了一半，但村民们自有一笔账：过去因急于脱贫而过度放牧，导致草场退化、载畜量减少，因而陷入更加贫困之中。这段经历提示人们：只有增加绿地，才能增加牲畜。郭二 保 朴实 的 话语 [[[,里,透,着 ] ] ] 农牧民的智慧：“你别看现在荒山秃岭，以后青山绿水，种啥不成规模，养啥不成气候呀？”,透,verbs of emission,new,given,definite,Location<Theme,-25,inanimate,inanimate,nonconcrete,nonconcrete,Locative inversion,Locative inversion,
773,"<s> 王喜没有想到，金枝今天变得这么爽快，而且边说边往化妆室小跑而去。看 得 出 , 那 步子 [ [ [",里,透,着 ]]] 急切 和 喜悦 。 </s>,透,verbs of emission,new,given,indefinite,Location=Theme,-1,inanimate,inanimate,nonconcrete,nonconcrete,Locative inversion,Locative inversion,
252,"1．熟悉皮肤电测试仪的操作和使用，了解怎样用皮肤电测试仪记录皮肤电反应的变化；2．被试坐在实验桌前，右手手心朝上平放在桌上。 主试 用 酒精 把 被 试手 掌 擦洗 干净 , [",,在," ] 手掌 上 涂 一 层 薄薄 的 导电膏 , 将 导 电棒 两 极 的 距离 调整 到 3 厘米 处 , 极 点 朝下 平放 [ 在 ] 被 试手 掌 中央 位置 。 同时 念 指 导语 : 【 文件名 : \ 当代 \ CWAC \ APL0095 . txt 文章 标题 : 作者 : 】 5449 : 这 是 一 个 测量 皮肤 电 的 实验 。 要 [ 在 ] 你 的 手心 上 放 两",涂,verbs of attachment,new,given,indefinite,Location<Theme,-4,inanimate,animate,body-part,concrete,uninversted sentence (PreLocPs),uninverted sentence,
548,"<s> 他 看见 她 的 指甲 , 十 只 指甲 [ [ [",上,涂抹,"着 ] ] ] 各 色 深浅 不同 的 蔻丹 , 有 的 , 还 黏贴 了 金色 银色 的 小 贴纸 。 </s>",涂抹,verbs of attachment,new,given,definite,Location<Theme,-4,inanimate,inanimate,concrete,concrete,Locative inversion,Locative inversion,
95,"在美国经济大萧条之后,新组建的SEC一直[",,在,"]会计实务中推行稳健政策,在会计计量中贯彻历史成本原则、停止与公允价值相关的会计实务。",推行,verbs of activity,new,new,indefinite,Location>Theme,2,inanimate,inanimate,nonconcrete,nonconcrete,uninversted sentence (PreLocPs),uninverted sentence,
383,"\ APJ0090 . txt 文章 标题 : 作者 : 】 5088 : 如 某 校 的 一 女生 , 托养 [ 在 ] 伯父 家 时 被 人 强奸 。 同 村 另 一 小 学生 父母 外出 打工 , 托付 给 爷爷 奶奶 照管 , 其 爷爷 、 奶奶 [ 在 ] 当地 被 视为 弱智人 , 根本 无 监护 能力 , 结果 这 个 孩子 偷开 别人 的 摩托车 , 撞死 [ 在 ] 电杆 上 。 殷 店 镇 某 村 一 个 孩子 托 养 [",,在,"] 亲戚家 , 因 缺少 照顾 , 一 天 突然 死 [",托养,verbs of creation,new,new,indefinite,Location<Theme,-5,animate,inanimate,place,human,uninversted sentence (PostLocPs),uninverted sentence,
253,"社会 里 , 语言 是 足够 传递 世代 间 的 经验 了 。 当 一 个 人 碰 着 生活 上 的 问题 时 , 他 必然 能 [",,在," ] 一 个 比 他 年长 的 人 那里 问 得到 解决 这 问题 的 有效 办法 , 因为 大家 [ 在 ] 同 一 环境 里 , 走 同 一 道路 , 他 先 走 , 你 后 走 ; 后 走 的 所 踏 的 是 先 走 的 人 的 脚印 , 口口相传 , 不 会 有 遗漏 。 那里 用得着 文字 ? 时间 里 没有 阻隔 , 拉得 十分",问得到,change of state,given,new,definite,Location=Theme,1,inanimate,animate,human,nonconcrete,uninversted sentence (PreLocPs),uninverted sentence,
497,<s> txt 文章 标题 : 作者 : 】 25872 : 何叔叔已经把烟袋从枕头底下拿出来了。他 手 [ [ [,里,握,"着 ] ] ] 烟袋 杆 , 把 烟 荷包 翻来覆去 地 看 。 </s>",握,verbs of holding or containing,given,given,definite,Location=Theme,,inanimate,animate,body-part,concrete,Locative inversion,Locative inversion,
586,"<s> txt 文章 标题 : 作者 : 】 32799 : ... 也 都 乘 马 , 手 中 高 举 长矛 , 矛头 上 大都 刺 着 一 个 血肉 模糊 的 首 级 , 马 [ [ [",后,系,"着 ] ] ] 长绳 , 缚 了 五 个 契丹 男子 。 </s>",系,verbs of attachment,new,given,indefinite,Location=Theme,,inanimate,inanimate,concrete,concrete,Locative inversion,Locative inversion,
850,"<s> 身 上 穿 着 黑色 天鹅绒 的 衣服 , 有 几 处 绒毛 已 磨 得 完全 脱落 了 , 脖子 [ [ [",上,系,"着 ] ] ] 美丽 的 针织 花带 , 胸 前 别 着 一 个 大 玉石 别针 。 </s>",系,verbs of attachment,new,given,indefinite,Location<Theme,-4,inanimate,animate,body-part,concrete,Locative inversion,Locative inversion,
84,"根据新准则对盈余管理可能产生的影响,并结合盈余管理本身的规律性,预计盈余管理将主要呈现出如下新的特点:(1)花样翻新。企业管理当局出于追求自身利益的最大化的动机,常常采取有违/协议0的行动,而会计准则的制定者和维护者(监管机构)为维护会计准则的严肃性,会做出检验企业管理当局是否遵守/协议0的制度安排,并对不遵守/协议0者予以惩罚。于是会计准则与盈余管理的博弈如同一场体育竞技赛,谁的技高一筹,谁将赢得比赛。盈余管理者深知在新的形势下以传统的方式、方法和领域进行盈余管理易被发现,其风险和成本太高,所以想方设法借用新准则的新规定、新内容进行/创新0当属必然。(2)时空性更突出。盈余管理的时空性集中体现在其操作领域、方式方法、的并存性及操作过程的间歇性、还原性和层次性等多个方面。随着新会计准则的实施,相关监管、审计力度的加强,盈余管理的成本必然随之加大,为降低风险和成本, 企业 必然 会 [",,在, ] 盈余 管理 的 时空 上 下 功夫 。 不同 行业 、 地区 、 层面 的 企业 会 针对 其 不同 的 生存 环境 、 不同 的 资源 配置 机制 、 不同 的 盈余 管理 成本 、 不同 的 发展 阶段 和 目标 、 不同 的 治理 结构 、 经营 理念,下功夫,verbs of activity,given,given,indefinite,Location>Theme,8,animate,inanimate,nonconcrete,organization,uninversted sentence (PreLocPs),uninverted sentence,
135,"经济学家 马歇尔 所 说 的 "" 社会 无 突变 "" 尤其 适用 于 改革 。 </s><s> 渐进式 改革 尽管 所 需 时间 长 , 但 付出 的 社会 代价 较 低 , 也 容易 为 社会 所 接受 。 </s><s> 渐进式 改革 就 是 [ 在 ] 不 改变 原有 经济 体制 基本 框架 的 前提 下 , 一点一点 地 变 。 </s><s> 承包制 并不 改变 原有 的 所有制 结构 , 不 改变 政治 体制 , 也 不 侵犯 原有 既 得 利益 集团 的 利益 , 实行 起来 阻力 要 小 得 多 。 </s><s> 探春 的 这 种 改革 就 没有 [",,在,"] 贾府 掀起 轩然大波 , 当权者们 也 未 加 激烈 反对 。 </s><s> 如果 [ 在 ] 计划 经济 下 一 开始 就 从 产权 这些 问题 开始 , 实行 私有化 , 恐怕 阻力 就 会 大 得 多 , 甚至 会 刚 开始 就 夭折 。 </s><s> 【 文件名 : \ 当代 \ CWAC \ CEB 0133 . </s><s> txt 文章 标题 : 作者 : 】 9458 : 而且 , 承包制 也 容易 [ 在 ] 短期 内 见效 。 </s><s> 因为 承包制 触及 利益 问题 , 改变 了 那 种 大锅饭 式 的 分配 格局 , 这 对 生产者 是 最 有效",掀起,verbs of activity,given,given,definite,Location=Theme,-1,inanimate,inanimate,place,nonconcrete,uninversted sentence (PreLocPs),uninverted sentence,
125,"我 的 函件 。 </s><s> 大家 这样 关心 这 个 研究 , 显然 除了 这 [ 在 ] 社会 科学 的 研究 上 是 一 个 新 的 课题 而 外 , 它 , 官僚 政治 , [ 在 ] 中国 当前 社会 改造 的 实践 上 , 也 是 一 个 非常 重要 的 课题 。 </s><s> 俨然 和 中国 政治史 同 其 悠久 的 官僚 政治 , 像 斩 了 头 随即 又 新生 起来 的 九头蛇 似的 怪物 , 许久 以来 就 以 其 不绝 的 "" 复活 "" 而 [ 在 ] 人们 心目 中 、 特别 [",,在,"] 官僚 意象 中 , 显示 其 "" 永生 "" 。 </s><s> 这 对于 "" 望治颇殷 "" 、 "" 除恶务尽 "" 的 志士仁人 , 有时 也 难免 引起 一些 迷惑 。 </s><s> 我 这 种 研究 , 无论如何 , 总是 希望 能 把 这 长久 笼罩 [ 在 ] 观念 尘雾 中 的 政治 暗影 或 社会 幽灵 , [ 在 ] 某 种 限度 内 让 其 原形 显现 出来 的 。 </s><s> 我 那 种 希望 , 究 [ 在 ] 何 种 程度 实现 了 , 那 要 诉之于 读 过 本 书 以后 的 读者 诸君 的 客观 评价",显示,verbs of activity,new,new,definite,Location<Theme,-11,inanimate,inanimate,nonconcrete,nonconcrete,uninversted sentence (PreLocPs),uninverted sentence,
225," 插入 / OIE 对象  OLEObert 菜单 项 , [ 在 ] 出现 的 "" 插入 对象 "" 对话 框 中选 "" 文件 创建 "" 菜单项 , 再 单击 "" 浏览 "" 按钮 , 从 出现 的 浏览 窗口 中 选定 要 插入 的 PowerPoint 文件 名 , 并 [ 在 ] 其 下面 选中 "" 链接 "" 项 , 单击 "" 镝定 "" 按钮 返回 显示 图标 的 编辑 窗口 。 此时 , 所 选定 PowerPoint 文件 的 第一 页 将 显示 [",,在, ] 显示 图标 的 编辑 窗口 中 。 再 执行 此 编辑 窗口 菜单 命令 中 的,显示,verbs of (dis)appearance,given,given,definite,Location=Theme,,inanimate,inanimate,concrete,concrete,uninversted sentence (PostLocPs),uninverted sentence,
429,"<s> txt 文章 标题 : 作者 : 】 5515 : .深夜，万籁俱寂。胡永丰用他那握惯了枪杆、笔杆的双手，熟练地敲打着键盘上的每一个键 , 屏幕 [ [ [",上,显示,着 ] ] ] 敌我 双方 态势 、 红蓝军 战斗 及 作战 结果 预测 ...... 【 文件名 : \ 当代 \ 报刊 \ 人民 日报 \ 1996年 人民 日报 \ 5月份 . </s>,显示,verbs of (dis)appearance,new,new,indefinite,Location<Theme,-15,inanimate,inanimate,concrete,nonconcrete,Locative inversion,Locative inversion,
431,<s> txt 文章 标题 : 作者 : 】 2440 : 从两场拍卖是在异常平静的气氛中进行的，未出现任何喧闹、“火爆”的场面。拍卖台 旁边 的 电视 屏幕 [ [ [,上,显示,"着 ] ] ] 被 拍卖 的 银器 及 国际 象棋 图像 , 竞买者 安静 地 坐 在 台下 。 </s>",显示,verbs of (dis)appearance,new,new,indefinite,Location<Theme,-2,inanimate,inanimate,concrete,concrete,Locative inversion,Locative inversion,
1,"。 </s><s> 生命 严格 说 不 只 是 横剖面 地 挂 搭 [ 在 ] 现 [ 在 ] 的 时空 中 , 若 只 是 那样 , 生命 就 没有 意义 ; 一定 还 要 有 纵贯 线 , 因此 有 生长 、 觉悟 过程 。 </s><s> 所谓 觉悟 , 就 是 要 把 人 的 纵贯线 唤醒 , 这 才 是 生命 的 扩大 。 </s><s> 横断面 的 扩大 要 保 得 住 、 要 有 意义 , 得 靠 纵贯 的 扩大 才 行 , 那 才 是 真正 的 扩大 。 </s><s> 所以 不 能 将 生命 只 限制 [",,在,"] 眼前 时间 的 这 一 瞬 、 空间 的 这 一 点 。 </s><s> 一旦 横切 , 人 就 什么 也 没有 了 。 </s><s> 现 [ 在 ] 的 年轻人 渐渐 地 横断面 的 意识 特别 强 , 或 表 讲 现 得 特别 明显 , 这样 , 纵贯 的 线索 就 连 不 起来 了 , 因此 没有 文化 生命 , 不 了解 文化 背景 , 因而 也 就 不 了解 这 套 智慧 之 根源 、 性格 以及 其 [ 在 ] 人生 中 的 作用 。 </s><s> 横断面 的 观念 较 容易 了解 , 亦 容易 表达 ,",限制,verbs of activity,given,new,definite,Location>Theme,13,inanimate,inanimate,place,nonconcrete,uninversted sentence (PostLocPs),uninverted sentence,
181,错觉是由客观与主观的双重因素互相作用而产生的。客观因素主要指眼睛本身的构造，光线在视网膜上成像的规律等等。视网膜上的图象是二维的、平面的，可我们感知到的世界却是有深度的、三维的，这就会影响我们主观的知觉整合。 [ 在 ] 视 错觉 中 最 主要 的 是 几何 图形 错觉 。 当 人们 把 注意 限制 [,,在," ] 线条 图形 的 某 一 个 简单 方面 , 如 它 的 长度 、 弯 曲度 、 面积 或 方向 时 , 有时 感知 的 结果 不 与 刺激 模式 相 对应 , 这些 特殊 的 事例 , 称作 几何 错觉 。 按照 几何 特点 , 错觉 可 分为 :",限制,verbs of holding or containing,new,new,definite,Location>Theme,11,inanimate,inanimate,nonconcrete,nonconcrete,uninversted sentence (PostLocPs),uninverted sentence,
302,"<s> 在迪尔夫妇指点下，我来到波尔—玛赫里镇的“基督山街”，踏进了有几分荒凉的基督山楼主的花园，放眼望去，但见一基督山堡首先映入眼帘。这 是 一 座 文艺复兴 式 的 三层 殿宇 , 一 扇 扇 窗户 [ [ [",上,镶,着 ] ] ] 荷马 、 索福克斯 、 莎士比亚 、 哥 德 、 拜伦 、 雨果 、 德拉维尼 等 的 侧面 像 ... 【 文件名 : \ 当代 \ 报刊 \ 人民 日报 \ 1996年 人民 日报 \ 7月份 . </s>,镶,verbs of image,new,new,definite,Location<Theme,-19,animate,inanimate,concrete,human,Locative inversion,Locative inversion,
607,<s> 7点45分时，妇女甚至连小孩也加入就餐的队伍中。他们的盘子中装满了热炸鸡、煮鸡蛋、玉米煎饼、面包圈、面饼圈和其他食品。旁边是一堆堆叠放整齐的衣物。到天黑时，这些衣物都会被领走的。喇叭 [ [ [,里,响,"着 ] ] ] 激动 人心 的 演 说 : "" 我们 就 是 世界 。 "" </s>",响,verbs of emission,new,new,indefinite,Location<Theme,-10,inanimate,inanimate,concrete,nonconcrete,Locative inversion,Locative inversion,
609,<s> txt 文章 标题 : 小 鲁宾逊 的 一 天 作者 : 】 26156 : “只一天，今天。”白力的眼泪终于流出来了。他想小兰回家一定会挨打。森林 [[[,里,响,着 ] ] ] 回巢 的 鸟 的 翅翼 声 。 </s>,响,verbs of emission,new,new,indefinite,Location<Theme,-5,inanimate,inanimate,place,nonconcrete,Locative inversion,Locative inversion,
775,<s> txt 文章 标题 : 作者 : 】 25520 : 在浙江德清钟管印染总公司向全国民政系统“孺子牛”赠奖的仪式上，当到会的有关部门领导同志和公司董事长张荣轩把奖杯和奖品交给１２名受奖者时，会场 [[[,上,响起,了 ]] ] 热烈 掌声 。 </s>,响起,verbs of emission,new,given,indefinite,Location=Theme,-1,inanimate,inanimate,place,nonconcrete,Locative inversion,Locative inversion,
